jenis_peraturan,nomor_peraturan,tahun,judul_peraturan,dokumen_peraturan
Peraturan Walikota,1908,2007, PEMBERIAN TAMBAHAN PENGHASILAN BAGI PEGAWAI NEGERI SIPIL DI LINGKUNGAN PEMERINTAH KOTA BANDUNG TAHUN ANGGARAN 2007 ,http://jdih.net/bandung/web/pdfperda/1908.Tahun 2007.pdf
Peraturan Walikota,678,2007, PEMBERIAN TAMBAHAN PENGHASILAN BAGI PEGAWAI NEGERI SIPIL DI LINGKUNGAN PEMERINTAH KOTA BANDUNG TAHUN ANGGARAN 2007,http://jdih.net/bandung/web/pdfperda/678.Tahun 2007.pdf
Peraturan Walikota,556,2007," PERCEPATAN PELAYANAN PENDAFTARAN PENDUDUK AKIBAT PERUBAHAN ALAMAT TEMPAT TINGGAL BAGI PENDUDUK YANG TERKENA DAMPAK PEMEKARAN, PEMBENTUKAN DAN PERUBAHAN NOMENKLATUR KECAMATAN DAN KELURAHAN DI LINGKUNGAN PEMERINTAH KOTA BANDUNG ",http://jdih.net/bandung/web/pdfperda/556.Tahun 2007.pdf
Peraturan Walikota,522,2007,"TATA CARA PELAKSANAAN PENEGAKAN SANKSI ADMINISTRASI TERHADAP PELANGGARAN PERATURAN DAERAH KOTA BANDUNG NOMOR 03 TAHUN 2005 TENTANG PENYELENGGARAAN KETERTIBAN, KEBERSIHAN DAN KEINDAHAN SEBAGAIMANA TELAH DIUBAH DENGAN PERATURAN DAERAH DAERAH KOTA BANDUNG NOMOR 11 TAHUN 2005",http://jdih.net/bandung/web/pdfperda/522.Tahun 2007.pdf
Peraturan Walikota,407,2007, PETUNJUK PENYELENGGARAAN REKLAME,http://jdih.net/bandung/web/pdfperda/407.Tahun 2007.pdf
Peraturan Walikota,375,2007, PETUNJUK PELAKSANAAN PENERIMAAN SISWA BARU PADA TAMAN KANAK-KANAK DAN SEKOLAH,http://jdih.net/bandung/web/pdfperda/375.Tahun 2007.pdf
Peraturan Walikota,374,2007, PETUNJUK PELAKSANAAN PERATURAN DAERAH KOTA BANDUNG NOMOR 20 TAHUN 2004 TENTANG KEDUDUKAN PROTOKOLER DAN KEUANGAN PIMPINAN DAN ANGGOTA DEWAN PERWAKILAN RAKYAT DAERAH KOTA BANDUNG SEBAGAIMANA TELAH DIUBAH UNTUK KEDUA KALI DENGAN PERATURAN DAERAH KOTA BANDUNG NOMOR 03 TAHUN 2007,http://jdih.net/bandung/web/pdfperda/374.Tahun 2007.pdf
Peraturan Walikota,321,2007, PETUNJUK PELAKSANAAN PENYALURAN/PEMBERIAN PROGRAM BANTUAN PENINGKATAN KEMAKMURAN,http://jdih.net/bandung/web/pdfperda/321.Tahun 2007.pdf
Peraturan Walikota,221,2007, TARIP AIR MINUM DAN BIAYA PELAYANAN LANGGANAN AIR MINUM DI KOTA BANDUNG,http://jdih.net/bandung/web/pdfperda/221.Tahun 2007.pdf
Peraturan Walikota,140,2007," STANDAR PENILAIAN CALON PEJABAT STRUKTURAL ESELON II. B, III DAN VI DI LINGKUNGAN PEMERINTAH KOTA BANDUNG",http://jdih.net/bandung/web/pdfperda/140.Tahun 2007.pdf
Peraturan Walikota,1908,2007, PEMBERIAN TAMBAHAN PENGHASILAN BAGI PEGAWAI NEGERI SIPIL DI LINGKUNGAN PEMERINTAH KOTA BANDUNG TAHUN ANGGARAN 2007 ,http://jdih.net/bandung/web/pdfperda/1908.Tahun 2007.pdf
Peraturan Walikota,678,2007, PEMBERIAN TAMBAHAN PENGHASILAN BAGI PEGAWAI NEGERI SIPIL DI LINGKUNGAN PEMERINTAH KOTA BANDUNG TAHUN ANGGARAN 2007,http://jdih.net/bandung/web/pdfperda/678.Tahun 2007.pdf
Peraturan Walikota,556,2007," PERCEPATAN PELAYANAN PENDAFTARAN PENDUDUK AKIBAT PERUBAHAN ALAMAT TEMPAT TINGGAL BAGI PENDUDUK YANG TERKENA DAMPAK PEMEKARAN, PEMBENTUKAN DAN PERUBAHAN NOMENKLATUR KECAMATAN DAN KELURAHAN DI LINGKUNGAN PEMERINTAH KOTA BANDUNG ",http://jdih.net/bandung/web/pdfperda/556.Tahun 2007.pdf
Peraturan Walikota,522,2007,"TATA CARA PELAKSANAAN PENEGAKAN SANKSI ADMINISTRASI TERHADAP PELANGGARAN PERATURAN DAERAH KOTA BANDUNG NOMOR 03 TAHUN 2005 TENTANG PENYELENGGARAAN KETERTIBAN, KEBERSIHAN DAN KEINDAHAN SEBAGAIMANA TELAH DIUBAH DENGAN PERATURAN DAERAH DAERAH KOTA BANDUNG NOMOR 11 TAHUN 2005",http://jdih.net/bandung/web/pdfperda/522.Tahun 2007.pdf
Peraturan Walikota,407,2007, PETUNJUK PENYELENGGARAAN REKLAME,http://jdih.net/bandung/web/pdfperda/407.Tahun 2007.pdf
Peraturan Walikota,375,2007, PETUNJUK PELAKSANAAN PENERIMAAN SISWA BARU PADA TAMAN KANAK-KANAK DAN SEKOLAH,http://jdih.net/bandung/web/pdfperda/375.Tahun 2007.pdf
Peraturan Walikota,374,2007, PETUNJUK PELAKSANAAN PERATURAN DAERAH KOTA BANDUNG NOMOR 20 TAHUN 2004 TENTANG KEDUDUKAN PROTOKOLER DAN KEUANGAN PIMPINAN DAN ANGGOTA DEWAN PERWAKILAN RAKYAT DAERAH KOTA BANDUNG SEBAGAIMANA TELAH DIUBAH UNTUK KEDUA KALI DENGAN PERATURAN DAERAH KOTA BANDUNG NOMOR 03 TAHUN 2007,http://jdih.net/bandung/web/pdfperda/374.Tahun 2007.pdf
Peraturan Walikota,321,2007, PETUNJUK PELAKSANAAN PENYALURAN/PEMBERIAN PROGRAM BANTUAN PENINGKATAN KEMAKMURAN,http://jdih.net/bandung/web/pdfperda/321.Tahun 2007.pdf
Peraturan Walikota,221,2007, TARIP AIR MINUM DAN BIAYA PELAYANAN LANGGANAN AIR MINUM DI KOTA BANDUNG,http://jdih.net/bandung/web/pdfperda/221.Tahun 2007.pdf
Peraturan Walikota,140,2007," STANDAR PENILAIAN CALON PEJABAT STRUKTURAL ESELON II. B, III DAN VI DI LINGKUNGAN PEMERINTAH KOTA BANDUNG",http://jdih.net/bandung/web/pdfperda/140.Tahun 2007.pdf
Peraturan Daerah,18,2007,PEMBENTUKAN DAN SUSUNAN ORGANISASI RUMAH SAKIT KHUSUS GIGI DAN MULUT KOTA BANDUNG,http://jdih.net/bandung/web/pdfperda/18.Tahun 2007.pdf
Peraturan Daerah,17,2007,PEMBENTUKAN DAN SUSUNAN ORGANISASI RUMAH SAKIT KHUSUS IBU DAN ANAK ,http://jdih.net/bandung/web/pdfperda/17.Tahun 2007.pdf
Peraturan Daerah,16,2007,PEMBENTUKAN DAN SUSUNAN ORGANISASI RUMAH SAKIT UMUM DAERAH KOTA BANDUNG,http://jdih.net/bandung/web/pdfperda/16.Tahun 2007.pdf
Peraturan Daerah,15,2007,PERUSAHAAN DAERAH PASAR BERMARTABAT KOTA BANDUNG,http://jdih.net/bandung/web/pdfperda/15.Tahun 2007.pdf
Peraturan Daerah,14,2007,PEMBENTUKAN DAN SUSUNAN ORGANISASI KECAMATAN DAN KELURAHAN DI LINGKUNGAN PEMERINTAH KOTA BANDUNG,http://jdih.net/bandung/web/pdfperda/PERDA NO.14 Tahun 2007 ttg Pembentukan dan Susunan Organisasi Kecamatan n Kelurahan.pdf
Peraturan Daerah,13,2007,PEMBENTUKAN DAN SUSUNAN ORGANISASI DINAS DAERAH KOTA BANDUNG ,http://jdih.net/bandung/web/pdfperda/13.Tahun 2007.pdf
Peraturan Daerah,12,2007,PEMBENTUKAN DAN SUSUNAN ORGANISASI LEMBAGA TEKNIS DAERAH KOTA BANDUNG,http://jdih.net/bandung/web/pdfperda/12.Tahun 2007.pdf
Peraturan Daerah,11,2007,PEMBENTUKAN DAN SUSUNAN ORGANISASI INSPEKTORAT KOTA BANDUNG ,http://jdih.net/bandung/web/pdfperda/11.Tahun 2007.pdf
Peraturan Daerah,10,2007,PEMBENTUKAN DAN SUSUNAN ORGANISASI SEKRETARIAT DAERAH KOTA BANDUNG DAN SEKRETARIAT DPRD KOTA BANDUNG ,http://jdih.net/bandung/web/pdfperda/10.Tahun 2007.pdf
Peraturan Daerah,9,2007,"PENCABUTAN PERATURAN DAERAH KOTA BANDUNG NOMOR 01 TAHUN 2005 TENTANG PENUNDAAN PELAKSANAAN PERATURAN DAERAH KOTA BANDUNG NOMOR 12, 13, 14, 15, 17, 18 DAN 19 TAHUN 2004 TENTANG PEMBENTUKAN DAN SUSUNAN ORGANISASI PERANGKAT DAERAH DI LINGKUNGAN DAERAH KOTA BANDUNG",-
Peraturan Daerah,8,2007,URUSAN PEMERINTAHAN DAERAH KOTA BANDUNG,http://jdih.net/bandung/web/pdfperda/08.Tahun 2007.pdf
Peraturan Daerah,7,2007,PERUBAHAN ANGGARAN PENDAPATAN DAN BELANJA DAERAH TAHUN ANGGARAN 2007 ,http://jdih.net/bandung/web/pdfperda/07.Tahun 2007.pdf
Peraturan Daerah,6,2007,PERTANGGUNGJAWABAN PELAKSANAAN ANGGARAN PENDAPATAN DAN BELANJA DAERAH TAHUN ANGGARAN 2006,http://jdih.net/bandung/web/pdfperda/06.Tahun 2007.pdf
Peraturan Daerah,5,2007,PENYERTAAN MODAL PEMERINTAH DAERAH KEPADA KOPERASI PEGAWAI PEMERINTAH KOTA BANDUNG,http://jdih.net/bandung/web/pdfperda/05.Tahun 2007.pdf
Peraturan Daerah,4,2007,PENYERTAAN MODAL PEMERINTAH KOTA BANDUNG KEPADA PT. BANK JABAR DAERAH KOTA BANDUNG ,http://jdih.net/bandung/web/pdfperda/04.Tahun 2007.pdf
Peraturan Daerah,3,2007,PERUBAHAN KEDUA ATAS PERATURAN DAERAH KOTA BANDUNG NOMOR 20 TAHUN 2004 TENTANG KEDUDUKAN PROTOKOLER DAN KEUANGAN PIMPINAN DAN ANGGOTA DEWAN PERWAKILAN RAKYAT DAERAH KOTA BANDUNG ,http://jdih.net/bandung/web/pdfperda/03.Tahun 2007.pdf
Peraturan Daerah,2,2007,PERUBAHAN ATAS PERATURAN DAERAH KOTA BANDUNG NOMOR 17 TAHUN 2001 TENTANG PENYELENGGARAAN REKLAME,http://jdih.net/bandung/web/pdfperda/02.Tahun 2007.pdf
Peraturan Daerah,1,2007,ANGGARAN PENDAPATAN DAN BELANJA DAERAH TAHUN ANGGARAN 2007 ,http://jdih.net/bandung/web/pdfperda/01.Tahun 2007.pdf
Peraturan Walikota,73,2007, KODE ETIK AUDITOR DI LINGKUNGAN BADAN PENGAWASAN DAERAH KOTA BANDUNG,http://jdih.net/bandung/web/pdfperda/073.Tahun 2007.pdf
Peraturan Walikota,63,2007,PENJABARAN ANGGARAN PENDAPATAN DAN BELANJA DAERAH TAHUN ANGGARAN 2007,http://jdih.net/bandung/web/pdfperda/063.Tahun 2007.pdf
