jenis_peraturan,nomor_peraturan,tahun,judul_peraturan,dokumen_peraturan
Peraturan Walikota,1007,2009,PETUNJUK TEKNIS PENYALURAN BANTUAN LANGSUNG MASYARAKAT (BLM) PROGRAM NASIONAL PEMBERDAYAAN MASYARAKAT MANDIRI PERKOTAAN (PNPM MP) KOTA BANDUNG,http://jdih.net/bandung/web/pdfperda/1007.per.Tahun 2009.pdf
Peraturan Walikota,1006,2009,PERUBAHAN ATAS PERATURAN WALIKOTA BANDUNG NOMOR 570 TAHUN 2009 TENTANG PETUNJUK PELAKSANAAN PENYALURAN/PEMBERIAN DANA HIBAH KEPENDIDIKAN UNTUK SISWA DAN WARGA BELAJAR DIKOTA BANDUNG,http://jdih.net/bandung/web/pdfperda/1006_perwal_2009.pdf
Peraturan Walikota,1000,2009,"TATA CARA PENYUSUNAN PERATURAN WALIKOTA, PERATURAN BERSAMA, KEPUTUSAN WALIKOTA, DAN INSTRUKSI WALIKOTA",http://jdih.net/bandung/web/pdfperda/1000_perwal_2009.pdf
Peraturan Walikota,999,2009,TATA NASKAH DINAS DI LINGKUNGAN PEMERINTAH KOTA BANDUNG,http://jdih.net/bandung/web/pdfperda/999_perwal_2009.pdf
Peraturan Walikota,996,2009,PEDOMAN OPERASIONAL PEMERIKSAAN REGULER INSPEKTORAT KOTA BANDUNG,http://jdih.net/bandung/web/pdfperda/996_perwal_2009.pdf
Peraturan Walikota,960,2009,PERUBAHAN ATAS PERATURAN WALIKOTA BANDUNG NOMOR 381 TAHUN 2009 TENTANG BELANJA SUBSIDI KEPADA PERUSAHAAN DAERAH KEBERSIHAN KOTA BANDUNG TAHUN ANGGARAN 2009,http://jdih.net/bandung/web/pdfperda/960_perwal_2009.pdf
Peraturan Walikota,940,2009,PERUBAHAN ATAS PERATURAN WALIKOTA NOMOR 542 TAHUN 2008 TENTANG SISTEM DAN PROSEDUR PENGELOLAAN KEUANGAN DAERAH,http://jdih.net/bandung/web/pdfperda/940_perwal_2009.pdf
Peraturan Walikota,938,2009,PENYALURAN PUPUK BERSUBSIDI SEKTOR PERTANIAN DI KOTA BANDUNG TAHUN 2009,http://jdih.net/bandung/web/pdfperda/938_perwal_2009.pdf
Peraturan Walikota,937,2009,PENGATURAN PELAYANAN AIR MINUM DAN AIR LIMBAH PADA PERUSAHAAN DAERAH AIR MINUM TIRTAWENING KOTA BANDUNG,http://jdih.net/bandung/web/pdfperda/937_perwal_2009.pdf
Peraturan Walikota,936,2009,ORGAN DAN KEPEGAWAIAN PADA PERUSAHAAN DAERAH AIR MINUM TIRTAWENING KOTA BANDUNG,http://jdih.net/bandung/web/pdfperda/936_perwal_2009.pdf
Peraturan Walikota,1007,2009,PETUNJUK TEKNIS PENYALURAN BANTUAN LANGSUNG MASYARAKAT (BLM) PROGRAM NASIONAL PEMBERDAYAAN MASYARAKAT MANDIRI PERKOTAAN (PNPM MP) KOTA BANDUNG,http://jdih.net/bandung/web/pdfperda/1007.per.Tahun 2009.pdf
Peraturan Walikota,1006,2009,PERUBAHAN ATAS PERATURAN WALIKOTA BANDUNG NOMOR 570 TAHUN 2009 TENTANG PETUNJUK PELAKSANAAN PENYALURAN/PEMBERIAN DANA HIBAH KEPENDIDIKAN UNTUK SISWA DAN WARGA BELAJAR DIKOTA BANDUNG,http://jdih.net/bandung/web/pdfperda/1006_perwal_2009.pdf
Peraturan Walikota,1000,2009,"TATA CARA PENYUSUNAN PERATURAN WALIKOTA, PERATURAN BERSAMA, KEPUTUSAN WALIKOTA, DAN INSTRUKSI WALIKOTA",http://jdih.net/bandung/web/pdfperda/1000_perwal_2009.pdf
Peraturan Walikota,999,2009,TATA NASKAH DINAS DI LINGKUNGAN PEMERINTAH KOTA BANDUNG,http://jdih.net/bandung/web/pdfperda/999_perwal_2009.pdf
Peraturan Walikota,996,2009,PEDOMAN OPERASIONAL PEMERIKSAAN REGULER INSPEKTORAT KOTA BANDUNG,http://jdih.net/bandung/web/pdfperda/996_perwal_2009.pdf
Peraturan Walikota,960,2009,PERUBAHAN ATAS PERATURAN WALIKOTA BANDUNG NOMOR 381 TAHUN 2009 TENTANG BELANJA SUBSIDI KEPADA PERUSAHAAN DAERAH KEBERSIHAN KOTA BANDUNG TAHUN ANGGARAN 2009,http://jdih.net/bandung/web/pdfperda/960_perwal_2009.pdf
Peraturan Walikota,940,2009,PERUBAHAN ATAS PERATURAN WALIKOTA NOMOR 542 TAHUN 2008 TENTANG SISTEM DAN PROSEDUR PENGELOLAAN KEUANGAN DAERAH,http://jdih.net/bandung/web/pdfperda/940_perwal_2009.pdf
Peraturan Walikota,938,2009,PENYALURAN PUPUK BERSUBSIDI SEKTOR PERTANIAN DI KOTA BANDUNG TAHUN 2009,http://jdih.net/bandung/web/pdfperda/938_perwal_2009.pdf
Peraturan Walikota,937,2009,PENGATURAN PELAYANAN AIR MINUM DAN AIR LIMBAH PADA PERUSAHAAN DAERAH AIR MINUM TIRTAWENING KOTA BANDUNG,http://jdih.net/bandung/web/pdfperda/937_perwal_2009.pdf
Peraturan Walikota,936,2009,ORGAN DAN KEPEGAWAIAN PADA PERUSAHAAN DAERAH AIR MINUM TIRTAWENING KOTA BANDUNG,http://jdih.net/bandung/web/pdfperda/936_perwal_2009.pdf
Peraturan Walikota,853,2009,PERUBAHAN ATAS PERATURAN WALIKOTA BANDUNG NOMOR 379 TAHUN 2009 TENTANG PETUNJUK TEKNIS PELAKSANAAN PENYALURAN/PEMBERIAN DANA HIBAH PROGRAM BAWAKU PANGAN (BANTUAN WALIKOTA KHUSUS MENGENAI PANGAN) KEPADA RUMAH TANGGA SASARAN PENERIMA MANFAAT (RTSPM) TAHUN 2009,http://jdih.net/bandung/web/pdfperda/853_perwal_2009.pdf
Peraturan Walikota,780,2009,PERUBAHAN ATAS PERATURAN WALIKOTA BANDUNG NOMOR 240 TAHUN 2009 TENTANG PEMBERIAN TAMBAHAN PENGHASILAN BAGI PEGAWAI NEGERI SIPIL DAERAH DI LINGKUNGAN PEMERINTAH,http://jdih.net/bandung/web/pdfperda/780_perwal_2009.pdf
Peraturan Walikota,777,2009,PERUBAHAN KEDUA ATAS PERATURAN WALIKOTA BANDUNG NOMOR 190 TAHUN 2009 TENTANG PENJABARAN ANGGARAN PENDAPATAN DAN BELANJA DAERAH KOTA BANDUNG,http://jdih.net/bandung/web/pdfperda/777_perwal_2009.pdf
Peraturan Walikota,739,2009,PETUNJUK PELAKSANAAN PENGGUNAAN HALAMAN DAN/ATAU GEDUNG DI LINGKUNGAN BLAIKOTA DAN PENDOPO,http://jdih.net/bandung/web/pdfperda/739_perwal_2009.pdf
Peraturan Walikota,735,2009,PETUNJUK PELAKSANAAN PENYELENGGARAAN DAN RETRIBUSI MENARA TELEKOMUNIKASI DI KOTA BANDUNG,http://jdih.net/bandung/web/pdfperda/735_perwal_2009.pdf
Peraturan Walikota,546,2009,PEDOMAN TEKNIS PENJUALAN KENDARAAN PERORANGAN DINAS DAN KENDARAAN DINAS OPERASIONAL,http://jdih.net/bandung/web/pdfperda/546_perwal_2009.pdf
Peraturan Walikota,545,2009,PERUBAHAN ATAS PERATURAN WALI KOTA BANDUNG NOMOR 371 TAHUN 2008 TENTANG PETUNJUK PELAKSANAAN PENERIMAAN SISWA BARU PADA TAMAN KANAK KANAK/RAUDHATUL ATHFAL DAN SEKOLAH MADRASAH ,http://jdih.net/bandung/web/pdfperda/545_perwal_2009.pdf
Peraturan Walikota,508,2009,PAKAIAN DINAS PEGAWAI DI LINGKUNGAN PEMERINTAH KOTA BANDUNG,http://jdih.net/bandung/web/pdfperda/508.per.Tahun 2009.pdf
Peraturan Walikota,476,2009,PROGRAM LEGISLASI DAERAH (PROLEGDA) TAHUN ANGGARAN 2009,http://jdih.net/bandung/web/pdfperda/476_perwal_2009.pdf
Peraturan Walikota,433,2009,PETUNJUK PELAKSANAAN PENGELOLAAN BIAYA OPERASIONAL SEKOLAH (BOS) PADA PENYELENGGARAAN PROGRAM SEKOLAH GRATIS DI KOTA BANDUNG TAHUN ANGGARAN 2009,http://jdih.net/bandung/web/pdfperda/433_perwal_2009.pdf
Peraturan Walikota,381,2009,BEKANJA SUBSIDI KEPADA PERUSAHAAN DAERAH KEBERSIHAN KOTA BANDUNG TAHUN ANGGARAN 2009,http://jdih.net/bandung/web/pdfperda/381_perwal_2009.pdf
Peraturan Walikota,379,2009,PETUNJUK TEKNIS PELAKSANAAN PENYALURAN PEMBERIAN DANA HIBAH PROGRAM BAWAKU PANGAN (BANTUAN WALIKOTA KHUSUS MENGENAI PANGAN) KEPADA RUMAH TANGGA SASARAN PENERIMA MANFAAT (RTSPM) TAHUN 2009,http://jdih.net/bandung/web/pdfperda/379_perwal_2009.pdf
Peraturan Walikota,378,2009,PEMANFAATAN DANA HIBAH PELAYANAN KESEHATAN MASYARAKAT MISKIN DI KOTA BANDUNG TAHUN ANGGARAN 2009,http://jdih.net/bandung/web/pdfperda/perwal_378_2009.pdf
Peraturan Walikota,374,2009,PERUBAHAN ATAS PERATURAN WALIKOTA BANDUNG NOMOR 190 TAHUN 2009 TENTANG PENJABARAN ANGGARAN PENDAPATAN DAN BELANJA DAERAH KOTA BANDUNG TAHUN ANGGARAN 2009,http://jdih.net/bandung/web/pdfperda/perwal_374_2009.pdf
Peraturan Walikota,335,2009,PETUNJUK PELAKSANAAN PENYALURAN PEMBERIAN HIBAH PROGRAM BAWAKU MAKMUR (BANTUAN WALIKOTA KHUSUS BIDANG KEMAKMURAN),http://jdih.net/bandung/web/pdfperda/perwal_335_ 2009.pdf
Peraturan Walikota,296,2009,PETUNJUK TEKNIS PENYUSUNAN NASKAH AKADEMIK,http://jdih.net/bandung/web/pdfperda/perwal_296_ 2009.pdf
Peraturan Walikota,240,2009,PEMBERIAN TAMBAHAN PENGHASILAN BAGI PEGAWAI NEGERI SIPIL DAERAH DI LINGKUNGAN PEMERINTAH KOTA BANDUNG,http://jdih.net/bandung/web/pdfperda/perwal_240_ 2009.pdf
Peraturan Walikota,236,2009,SUSUNAN ORGANISASI DAN TATA KERJA PERUSAHAAN DAERAH AIR MINUM KOTA BANDUNG,http://jdih.net/bandung/web/pdfperda/perwal_236_ 2009.pdf
Peraturan Walikota,218,2009,PEMBENTUKAN DAN SUSUNAN ORGANISASI UNIT PELAKSANA TEKNIS PEMUNGUTAN PAJAK PADA DINAS PENDAPATAN KOTA BANDUNG,http://jdih.net/bandung/web/pdfperda/perwal_218_ 2009.pdf
Peraturan Daerah,30,2009,PERUBAHAN PERDA KOTA BANDUNG NO. 08 TAHUN 2009 TENTANG ANGGARAN PENDAPATAN DAN BELANJA DAERAH TAHUN 2009 ,-
Peraturan Daerah,29,2009,RETRIBUSI PELAYANAN ADMINISTRASI KEPENDUDUKAN ,http://jdih.net/bandung/web/pdfperda/perda_29_2009.pdf
Peraturan Daerah,28,2009, PAJAK RESTORAN ,http://jdih.net/bandung/web/pdfperda/perda_28_2009.pdf
Peraturan Daerah,27,2009,PAJAK HOTEL ,http://jdih.net/bandung/web/pdfperda/perda_27_2009.pdf
Peraturan Daerah,26,2009,PEMBERDAYAAN PENYANDANG CACAT ,http://jdih.net/bandung/web/pdfperda/perda_26_2009.pdf
Peraturan Daerah,25,2009, HUTAN KOTA ,http://jdih.net/bandung/web/pdfperda/perda_25_2009.pdf
Peraturan Daerah,24,2009,MEKANISME KERJASAMA ASSET DAERAH ,http://jdih.net/bandung/web/pdfperda/perda_24_2009.pdf
Peraturan Daerah,23,2009,"USAHA MIKRO, KECIL DAN MENENGAH ",http://jdih.net/bandung/web/pdfperda/perda_23_2009.pdf
Peraturan Daerah,22,2009,PENYELENGGARAAN PERIJINAN ,http://jdih.net/bandung/web/pdfperda/perda_22_2009.pdf
Peraturan Daerah,21,2009,LAPORAN PERTANGGUNGJAWABAN PELAKSANAAN APBD TAHUN ANGGARAN 2008 ,http://jdih.net/bandung/web/pdfperda/perda_21_2009.pdf
Peraturan Daerah,20,2009,PERUBAHAN KEDUA ATAS PERDA KOTA BANDUNG NO. 17 TAHUN 2001 TENTANG PENYELENGGARAAN REKLAME ,http://jdih.net/bandung/web/pdfperda/perda_20_2009.pdf
Peraturan Daerah,19,2009,PENGELOLAAN KAWASAN DAN BANGUNAN CAGAR BUDAYA ,http://jdih.net/bandung/web/pdfperda/perda_19_2009.pdf
Peraturan Daerah,18,2009,PENYERTAAN MODAL PEMERINTAH KOTA BANDUNG KEPADA PERUSAHAAN DAERAH BPR KOTA BANDUNG ,http://jdih.net/bandung/web/pdfperda/perda_18_2009.pdf
Peraturan Daerah,17,2009,PERUBAHAN ATAS PERDA KOTA BANDUNG NO. 04 TAHUN 2009 TENTANG PERUSAHAAN DAERAH BANK PERKREDITAN RAKYAT KOTA BANDUNG ,http://jdih.net/bandung/web/pdfperda/perda_17_2009.pdf
Peraturan Daerah,16,2009,PENYERTAAN MODAL PEMERINTAH KOTA BANDUNG KEPADA PDAM TIRTAWENING KOTA BANDUNG ,http://jdih.net/bandung/web/pdfperda/perda_16_2009.pdf
Peraturan Daerah,15,2009,PDAM TIRTAWENING KOTA BANDUNG ,http://jdih.net/bandung/web/pdfperda/perda_15_2009.pdf
Peraturan Daerah,14,2009,PEMBENTUKAN DAN SUSUNAN ORGANISASI RUMAH SAKIT KHUSUS IBU DAN ANAK KOTA BANDUNG ,http://jdih.net/bandung/web/pdfperda/perda_14_2009.pdf
Peraturan Daerah,13,2009,PERUBAHAN ATAS PERDA KOTA BANDUNG NO. 13 TAHUN 2007 TENTANG PEMBENTUKAN DAN SUSUNAN ORGANISASI DINAS DAERAH KOTA BANDUNG,http://jdih.net/bandung/web/pdfperda/perda_13_2009.pdf
Peraturan Daerah,12,2009, PERUBAHAN ATAS PERDA KOTA BANDUNG NO. 12 TAHUN 2007 TENTANG PEMBENTUKAN DAN SUSUNAN ORGANISASI LEMBAGA TEKNIS DAERAH KOTA BANDUNG,http://jdih.net/bandung/web/pdfperda/perda_12_2009.pdf
Peraturan Daerah,11,2009,PERUBAHAN ATAS PERDA KOTA BANDUNG NO. 10 TAHUN 2007 TENTANG PEMBENTUKAN DAN SUSUNAN ORGANISASI SEKRETARIAT DAERAH KOTA BANDUNG DAN SEKRETARIAT DPRD KOTA BANDUNG,http://jdih.net/bandung/web/pdfperda/perda_11_2009.pdf
Peraturan Daerah,10,2009,SISTEM KESEHATAN KOTA BANDUNG,http://jdih.net/bandung/web/pdfperda/perda_10_2009.pdf
Peraturan Walikota,14,2009,STANDARISASI SARANA DAN PRASARANA KERJA DI LINGKUNGAN PEMERINTAH KOTA BANDUNG,http://jdih.net/bandung/web/pdfperda/014_perwal_2009.pdf
Peraturan Walikota,13,2009,PEMBAYARAN BELANJA PENDAHULUAN YANG BERSIFAT MENGIKAT DAN WAJIB TAHUN ANGGARAN 2009,http://jdih.net/bandung/web/pdfperda/013_perwal_ 2009.pdf
Peraturan Daerah,9,2009,RENCANA PEMBANGUNAN JANGKA MENENGAH DAERAH (RPJMD) TAHUN 2009-2013,http://jdih.net/bandung/web/pdfperda/perda_09_2009.pdf
Peraturan Daerah,8,2009,ANGGARAN PENDAPATAN DAN BELANJA DAERAH TAHUN ANGGARAN 2009,http://jdih.net/bandung/web/pdfperda/perda_08_2009.pdf
Peraturan Daerah,7,2009,PENYELENGGARAAN ADMINISTRASI KEPENDUDUKAN,http://jdih.net/bandung/web/pdfperda/perda_07_2009.pdf
Peraturan Daerah,6,2009,KEGIATAN PEMBANGUNAN STADION UTAMA SEPAK BOLA DALAM KONTRAK TAHUN JAMAK,http://jdih.net/bandung/web/pdfperda/perda_06_2009.pdf
Peraturan Daerah,5,2009,"PERUBAHAN PERATURAN DAERAH KOTA BANDUNG NOMOR 07 TAHUN 2008 TENTANG TAHAPAN TATA CARA PENYUSUNAN, PENGENDALIAN DAN EVALUASI PELAKSANAAN RENCANA PEMBANGUNAN SERTA MUSYAWARAH PERENCANAAN PEMBANGUNAN DAERAH",http://jdih.net/bandung/web/pdfperda/perda_05_2009.pdf
Peraturan Daerah,4,2009,PERUSAHAAN DAERAH BANK PERKREDITAN RAKYAT KOTA BANDUNG,http://jdih.net/bandung/web/pdfperda/perda_04_2009.pdf
Peraturan Daerah,3,2009,PENYERTAAN MODAL PEMERINTAH DAERAH KEPADA KOPERASI PEGAWAI PEMERINTAH KOTA BANDUNG,http://jdih.net/bandung/web/pdfperda/perda_03_2009.pdf
Peraturan Daerah,2,2009,PENATAAN PASAR TRADISIONAL PUSAT PERBELANJAAN DAN TOKO MODERN,http://jdih.net/bandung/web/pdfperda/perda_02_2009.pdf
