id,nama_paket,pagu,metode_pemilihan,sumber_dana,instansi,skpd,tahun_anggaran,nama_kegiatan,jenis_belanja,jenis_pengadaan,volume,lokasi,deskripsi,sumber_dana_detail,pagu_detail,mata_anggaran,pemilihan_penyedia,awal_pemilihan,akhir_pemilihan,awal_pekerjaan,akhir_pekerjaan,
7490083,Belanja Modal Peralatan dan Mesin Pengadaan UPS,6000000,e-Purchasing,APBD,Pemerintah Daerah Kota Bandung,DINAS KESEHATAN,2016,Penyediaan Peralatan dan Perlengkapan Kantor,Modal,Barang,4 Unit,Kota Bandung,Belanja Modal Peralatan dan Mesin Pengadaan UPS,APBD,6000000,1.02.1.02.01.01.01.13.5.2.3.29.02,E-Purchasing,01/06/2016,31/07/2016,01/08/2016,31/08/2016,
6667079,Belanja makanan dan minuman pada kegiatan Pelayanan penjaringan kesehatan siswa SD dan setingkat,78000000,Pengadaan Langsung,APBD,Pemerintah Daerah Kota Bandung,DINAS KESEHATAN,2016,Pelayanan penjaringan kesehatan siswa SD dan setingkat,Barang/jasa,Jasa Lainnya,1560 OK,Kota Bandung,Belanja makanan dan minuman pada kegiatan Pelayanan penjaringan kesehatan siswa SD dan setingkat,APBD,78000000,1.02.1.02.01.01.34.2.5.2.2.11.05,Pengadaan Langsung,19/02/2016,29/02/2016,01/03/2016,30/04/2016,
7826087,Belanja makanan dan minuman kegiatan pada kegiatan BOK UPT Puskesmas Sukajadi,140516000,Pengadaan Langsung,APBD,Pemerintah Daerah Kota Bandung,DINAS KESEHATAN,2016,Bantuan Operasional Kesehatan (DAK) ,Barang/jasa,Jasa Lainnya,1 tahun,Kota Bandung,Belanja makanan dan minuman kegiatan pada kegiatan BOK UPT Puskesmas Sukajadi,APBD,140516000,1.02.1.02.01.04.16.43.5.2.2.11.05,Pengadaan Langsung,29/09/2016,14/10/2016,14/10/2016,15/12/2016,
7039754,Belanja barang alkes habis pakai laboratorium,300000000,Lelang Sederhana,APBD,Pemerintah Daerah Kota Bandung,DINAS KESEHATAN,2016,Pengadaan obat dan perbekalan kesehatan,Barang/jasa,Barang,1 tahun,Kota Bandung,Belanja barang alkes habis pakai laboratorium untuk kebutuhan dinas kesehatan kota bandung,APBD,300000000,1.02.1.02.01.15.01.5.2.2.02.04,Lelang Sederhana,01/03/2016,31/03/2016,01/04/2016,30/04/2016,
7139632,Belanja makanan dan minuman kegiatan ,22000000,Pengadaan Langsung,APBD,Pemerintah Daerah Kota Bandung,DINAS KESEHATAN,2016,Pelayanan kesehatan rujukan pasien masyarakat miskin,Barang/jasa,Jasa Lainnya,1 paket,Kota Bandung,Belanja makanan dan minuman kegiatan pada kegiatan pelayanan kesehatan rujukan pasien masyarakat miskin,APBD,22000000,1.02.1.02.01.35.01.5.2.2.11.05,Pengadaan Langsung,01/02/2016,28/02/2016,01/03/2016,31/10/2016,
7064787,Belanja makanan dan minuman kegiatan,39400000,Pengadaan Langsung,APBD,Pemerintah Daerah Kota Bandung,DINAS KESEHATAN,2016,Penyusunan standar pelayanan kesehatan,Barang/jasa,Jasa Lainnya,1 paket,Kota Bandung,Belanja makanan dan minuman kegiatan pada kegiatan penyusunan standar pelayanan kesehatan,APBD,39400000,1.02.1.02.01.23.01.5.2.2.11.01,Pengadaan Langsung,01/03/2016,18/03/2016,18/03/2016,29/04/2016,
8370438,Belanja penggandaan Dinas,90975000,Pengadaan Langsung,APBDP,Pemerintah Daerah Kota Bandung,DINAS KESEHATAN,2016,Penyediaan barang cetakan dan penggandaan,Barang/jasa,Jasa Lainnya,1 tahun,Kota Bandung,Belanja penggandaan Dinas pada program pelayanan adminitrasi perkantoran,APBDP,90975000,1.02.1.02.01.01.01.11.5.2.2.06.01,Pengadaan Langsung,18/11/2016,26/11/2016,28/11/2016,17/12/2016,
6666442,Belanja makanan dan minuman rapat pada kegiatan Pelayanan ibu hamil KEK,23200000,Pengadaan Langsung,APBD,Pemerintah Daerah Kota Bandung,DINAS KESEHATAN,2016,Pelayanan ibu hamil KEK,Barang/jasa,Jasa Lainnya,290 OH,Kota Bandung,Belanja makanan dan minuman rapat pada kegiatan Pelayanan ibu hamil KEK,APBD,23200000,1.02.1.02.01.01.34.19.5.2.2.11.02,Pengadaan Langsung,21/03/2016,04/04/2016,05/04/2016,31/08/2016,
7826224,Belanja bahan medis habis pakai pada kegiatan BOK UPT Puskesmas Ciumbuleuit,37291238,e-Purchasing,APBD,Pemerintah Daerah Kota Bandung,DINAS KESEHATAN,2016,Bantuan Operasional Kesehatan (DAK),Barang/jasa,Barang,1 tahun,kota Bandung,Belanja bahan medis habis pakai pada kegiatan BOK UPT Puskesmas Ciumbuleuit,APBD,37291238,1.02.1.02.01.07.16.43.5.2.2.02.09,E-Purchasing,29/09/2016,14/10/2016,14/10/2016,15/12/2016,
6665880,Belanja modal peralatandan mesin-pengadaan bidang pendidikan/keterampilan lain-lain-pengadaan alat peraga pada kegiatan Pelayanan neonatus dengan komplikasi yang ditangani,57750000,Pengadaan Langsung,APBD,Pemerintah Daerah Kota Bandung,DINAS KESEHATAN,2016,Pelayanan neonatus dengan komplikasi yang ditangani,Modal,Barang,19 bh,Kota Bandung,Belanja modal peralatandan mesin-pengadaan bidang pendidikan/keterampilan lain-lain-pengadaan alat peraga pada kegiatan Pelayanan neonatus dengan komplikasi yang ditangani,APBD,57750000,1.02.1.02.01.01.34.14.5.2.2.37.13,Pengadaan Langsung,19/02/2016,29/02/2016,01/03/2016,31/03/2016,
7391105,Rehabilitasi gedung Bangunan Puskesmas jajaway,200000000,Pengadaan Langsung,APBD,Pemerintah Daerah Kota Bandung,DINAS KESEHATAN,2016,Rehabilitasi Puskesmas,Modal,Pekerjaan Konstruksi,1 Paket,Kota Bandung,Rehabilitasi gedung Bangunan Puskesmas jajaway,APBD,200000000,1.02.1.02.01.01.25.24.5.2.3.49.06,Pengadaan Langsung,01/07/2016,20/07/2016,21/07/2016,20/09/2016,
7826956,Belanja Bahan Medis Habis Pakai UPT PKM Talaga Bodas,45739803,Pengadaan Langsung,APBD,Pemerintah Daerah Kota Bandung,DINAS KESEHATAN,2016,Bantuan Operasional Kesehatan (DAK) UPT PKM Talaga Bodas,Barang/jasa,Barang,1 Paket,Kota Bandung,Belanja Bahan Medis Habis Pakai UPT PKM Talaga Bodas,APBD,45739803,1.02.1.02.01.15.16.43.5.2.2.02.09,Pengadaan Langsung,11/07/2016,11/08/2016,12/08/2016,28/12/2016,
6657073,Belanja jasa penyelenggaraan acara optimasi kader kesehatan remaja pada kegiatan Pelayanan penjaringan kesehatan siswa SMP/SMA dan setingkat,56635000,Pengadaan Langsung,APBD,Pemerintah Daerah Kota Bandung,DINAS KESEHATAN,2016,Pelayanan penjaringan kesehatan siswa SMP/SMA dan setingkat,Barang/jasa,Jasa Lainnya,1 paket,Kota Bandung,Belanja jasa penyelenggaraan acara optimasi kader kesehatan remaja Pelayanan penjaringan kesehatan siswa SMP/SMA dan setingkat,APBD,56635000,1.02.1.02.01.01.16.33.5.2.2.03.21,Pengadaan Langsung,21/03/2016,31/03/2016,01/04/2016,30/04/2016,
8166981,Belanja Bahan Medis Habis Pakai pada UPT PKM Neglasari,32869812,Pengadaan Langsung,APBD,Pemerintah Daerah Kota Bandung,DINAS KESEHATAN,2016,Bantuan Operasional Puskesmas (DAK) UPT PKM Neglasari,Barang/jasa,Barang,1 Tahun,Kota Bandung,Belanja Bahan Medis Habis Pakai pada UPT PKM Neglasari,APBD,32869812,1.02.1.02.01.06.16.43.5.2.2.02.09,Pengadaan Langsung,10/10/2016,20/10/2016,21/10/2016,09/12/2016,
7010524,Belanja pengadaan alat pemeriksaan dan pengambilan spesimen AFP dan PD3I,104500000,Pengadaan Langsung,APBD,Pemerintah Daerah Kota Bandung,DINAS KESEHATAN,2016,Penemuan dan penanganan Acute Flacid Paralysis (AFP) Rate Per 100.000 penduduk < 15 tahun,Modal,Barang,1 Paket,Kota Bandung,Belanja pengadaan alat pemeriksaan dan pengambilan spesimen AFP dan PD3I,APBD,104500000,1.02.1.02.01.01.34.4.5.2.3.36.14,Pengadaan Langsung,15/02/2016,25/02/2016,26/02/2016,30/04/2016,
7380450,Kalibrasi Alat,50000000,Pengadaan Langsung,APBD,Pemerintah Daerah Kota Bandung,DINAS KESEHATAN,2016,Rehabilitasi Puskesmas,Barang/jasa,Jasa Lainnya,1 Paket,Kota Bandung,Kalibrasi Alat Alkes di Puskesmas,APBD,50000000,1.02.1.02.01.01.25.24.5.2.2.20.08,Pengadaan Langsung,02/05/2016,18/05/2016,19/05/2016,19/09/2016,
7825997,Belanja makanan dan minuman kegiatn pada kegiatan BOP UPT Puskesmas Sukarasa,122889476,Pengadaan Langsung,APBD,Pemerintah Daerah Kota Bandung,DINAS KESEHATAN,2016,Bantuan Operasional Kesehatan (DAK),Barang/jasa,Jasa Lainnya,1 tahun ,Kota Bandung,Belanja makanan dan minuman kegiatn pada kegiatan BOP UPT Puskesmas Sukarasa,APBD,122889476,1.02.1.02.01.05.16.43.5.2.2.11.05,Pengadaan Langsung,29/09/2016,14/10/2016,14/10/2016,15/12/2016,
7022468,Belanja kursus-kursus singkat/pelatihan: Pelatihan program P2 Kusta untuk dokter fungsional puskesmas,105000000,Pengadaan Langsung,APBD,Pemerintah Daerah Kota Bandung,DINAS KESEHATAN,2016,Pelayanan pencegahan dan penanggulangan penyakit menular,Barang/jasa,Jasa Lainnya,1 Paket,Kota Bandung,Pelatihan program P2 Kusta untuk dokter fungsional puskesmas,APBD,105000000,1.02.1.02.01.01.22.5.5.2.2.17.01,Pengadaan Langsung,16/03/2016,31/03/2016,01/04/2016,31/10/2016,
7380607,Pemeliharaan AC,50000000,Pengadaan Langsung,APBD,Pemerintah Daerah Kota Bandung,DINAS KESEHATAN,2016,Rehabilitasi Puskesmas,Barang/jasa,Jasa Lainnya,1 Paket,Kota Bandung,Pemeliharaan AC,APBD,50000000,1.02.1.02.01.01.25.24.5.2.2.20.08,Pengadaan Langsung,02/05/2016,18/05/2016,19/05/2016,18/10/2016,
7468740,Pemeliharaan  gedung dan bangunan UPT Yankesmob,120000000,Pengadaan Langsung,APBD,Pemerintah Daerah Kota Bandung,DINAS KESEHATAN,2016,Pemeliharaan rutin/berkala gedung kantor,Barang/jasa,Pekerjaan Konstruksi,1 Paket,Kota Bandung,Pemeliharaan gedung dan bangunan UPT Yankesmob,APBD,120000000,1.02.1.02.01.01.02.22.5.2.2.20.05,Pengadaan Langsung,01/06/2016,30/06/2016,01/07/2016,31/08/2016,
8166581,Belanja Makanan dan Minuman Kegiatan pada UPT PKM Babakan Sari,101996269,Pengadaan Langsung,APBD,Pemerintah Daerah Kota Bandung,DINAS KESEHATAN,2016,Bantuan Operasional Puskesmas (DAK) UPT PKM Babakan Sari,Barang/jasa,Jasa Lainnya,1 Tahun,Kota Bandung,Belanja Makanan dan Minuman Kegiatan pada UPT PKM Babakan Sari,APBD,101996269,1.02.1.02.01.12.16.43.5.2.2.11.05,Pengadaan Langsung,10/10/2016,20/10/2016,21/10/2016,09/12/2016,
8681690,Penggandaan,50000000,Pengadaan Langsung,APBD,Pemerintah Daerah Kota Bandung,DINAS KESEHATAN,2016,Pemeliharan rutin/berkala gedung kantor,Barang/jasa,Barang,1 Paket,Jl. Supratman No 73 Bandung,Penggandaan,APBD,50000000,1.02.1.02.01.01.02.22.5.2.2.06.02,Pengadaan Langsung,15/11/2016,25/11/2016,28/11/2016,23/12/2016,
7827828,Belanja Makanan dan Minuman Kegiatan UPT PKM Margahayu Raya,90024179,Pengadaan Langsung,APBD,Pemerintah Daerah Kota Bandung,DINAS KESEHATAN,2016,Bantuan Operasional Kesehatan (DAK) UPT PKM Margahayu Raya,Barang/jasa,Jasa Lainnya,1 Tahun,Kota Bandung,Belanja Makanan dan Minuman Kegiatan UPT PKM Margahayu Raya,APBD,90024179,1.02.1.02.01.23.16.43.5.2.2.11.05,Pengadaan Langsung,11/07/2016,11/08/2016,12/08/2016,28/12/2016,
7391127,Konsultan Pengawas Puskesmas jajaway,10000000,Pengadaan Langsung,APBD,Pemerintah Daerah Kota Bandung,DINAS KESEHATAN,2016,Rehabilitasi Puskesmas,Modal,Jasa Konsultansi,1 Paket,Kota Bandung,Konsultan Pengawas Puskesmas jajaway,APBD,10000000,1.02.1.02.01.01.25.24.5.2.3.49.06,Pengadaan Langsung,01/07/2016,20/07/2016,21/07/2016,20/09/2016,
8428315,Belanja Jasa konsultansi perencanaan  DED Puskesmas Babatan,50000000,Pengadaan Langsung,APBDP,Pemerintah Daerah Kota Bandung,DINAS KESEHATAN,2016,Pembangunan Puskesmas,Barang/jasa,Jasa Konsultansi,1 paket,Kota Bandung,Belanja Jasa konsultansi perencanaan DED Puskesmas Babatan,APBDP,50000000,1.02.1.02.01.01.25.01.5.2.2.07.02,Pengadaan Langsung,18/11/2016,26/11/2016,28/11/2016,08/12/2016,
7007788,Belanja makanan dan minuman kegiatan,150000000,Pengadaan Langsung,APBD,Pemerintah Daerah Kota Bandung,DINAS KESEHATAN,2016,Pelayanan penderita DBD yang ditangani,Barang/jasa,Jasa Lainnya,1 Paket,Kota Bandung,Belanja makanan dan minuman kegiatan,APBD,150000000,1.02.1.02.01.01.34.7.5.2.2.11.05,Pengadaan Langsung,14/03/2016,31/03/2016,01/04/2016,30/09/2016,
7468406,Pemeliharaan  gedung dan bangunan Puskesmas Cibolerang,40000000,Pengadaan Langsung,APBD,Pemerintah Daerah Kota Bandung,DINAS KESEHATAN,2016,Pemeliharaan rutin/berkala gedung kantor,Barang/jasa,Pekerjaan Konstruksi,1 Paket,Kota Bandung,Pemeliharaan gedung dan bangunan Puskesmas Cibolerang,APBD,40000000,1.02.1.02.01.01.02.22.5.2.2.20.05,Pengadaan Langsung,01/06/2016,30/06/2016,01/07/2016,31/07/2016,
7390877,Konsultan Perencana Puskesmas Antapani,25000000,Pengadaan Langsung,APBD,Pemerintah Daerah Kota Bandung,DINAS KESEHATAN,2016,Rehabilitasi Puskesmas,Modal,Jasa Konsultansi,1 Paket,Kota Bandung,Konsultan Perencana Puskesmas Antapani,APBD,25000000,1.02.1.02.01.01.25.24.5.2.3.49.06,Pengadaan Langsung,01/06/2016,22/06/2016,23/06/2016,22/07/2016,
6663951,Belanja penggandaan orientasi jaminan mutu program KB bagi bidan penegelola KB Puskesmas di Kota Bandung pada kegiatan Pelayanan peserta KB aktif,12375000,Pengadaan Langsung,APBD,Pemerintah Daerah Kota Bandung,DINAS KESEHATAN,2016,Pelayanan peserta KB aktif,Barang/jasa,Barang,1 paket,Kota Bandung,Belanja penggandaan orientasi jaminan mutu program KB bagi bidan penegelola KB Puskesmas di Kota Bandung pada kegiatan Pelayanan peserta KB aktif,APBD,12375000,1.02.1.02.01.01.34.3.5.2.2.06.02,Pengadaan Langsung,11/01/2016,18/01/2016,01/02/2016,31/10/2016,
8166932,Belanja Alat Tulis Kantor pada UPT PKM Neglasari,17928988,Pengadaan Langsung,APBD,Pemerintah Daerah Kota Bandung,DINAS KESEHATAN,2016,Bantuan Operasional Puskesmas (DAK) UPT PKM Neglasari,Barang/jasa,Barang,1 Tahun,Kota Bandung,Belanja Alat Tulis Kantor pada UPT PKM Neglasari,APBD,17928988,1.02.1.02.01.06.16.43.5.2.2.01.01,Pengadaan Langsung,10/10/2016,20/10/2016,21/10/2016,09/12/2016,
7063117,Belanja alat tulis kantor,24600000,Pengadaan Langsung,APBD,Pemerintah Daerah Kota Bandung,DINAS KESEHATAN,2016,Sosialisasi kawasan tanpa asap rokok,Barang/jasa,Barang,1 paket,Kota Bandung,Belanja alat tulis kantor pada kegiatan sosialisasi kawasan tanpa asap rokok,APBD,24600000,1.02.1.02.01.21.05.5.2.2.01.01,Pengadaan Langsung,01/02/2016,29/02/2016,01/03/2016,31/05/2016,
7381440,Rehabilitasi Gedung Bangunan Puskesmas Pasir Layung,200000000,Pengadaan Langsung,APBD,Pemerintah Daerah Kota Bandung,DINAS KESEHATAN,2016,Rehabilitasi Puskesmas,Modal,Pekerjaan Konstruksi,1 Paket,Kota Bandung,Rehabilitasi Gedung Bangunan Puskesmas Pasir Layung,APBD,200000000,1.02.1.02.01.01.25.24.5.2.3.49.06,Pengadaan Langsung,01/06/2016,22/06/2016,23/06/2016,22/08/2016,
6662657,Belanja kursus-kursus singkat/pelatihan-intelegensia pada lansia bagi petugas pada kegiatan pelayanan kesehatan,85000000,Pengadaan Langsung,APBD,Pemerintah Daerah Kota Bandung,DINAS KESEHATAN,2016,Pelayanan kesehatan,Barang/jasa,Jasa Lainnya,1 paket,Kota Bandung,Belanja kursus-kursus singkat/pelatihan-intelegensia pada lansia bagi petugas pada kegiatan pelayanan kesehatan,APBD,85000000,1.02.1.02.01.01.30.6.5.2.2.17.01,Pengadaan Langsung,19/02/2016,31/03/2016,01/04/2016,30/04/2016,
7141898,Belanja modal peralatan dan mesin - pengadaan peralatan jaringan komputer puskesmas,126000000,Pengadaan Langsung,APBD,Pemerintah Daerah Kota Bandung,DINAS KESEHATAN,2016,Pengembangan data dan informasi pembangunan kesehatan ,Modal,Barang,126 titik,Kota Bandung,Belanja modal peralatan dan mesin - pengadaan peralatan jaringan komputer puskesmas,APBD,126000000,1.02.1.02.01.36.03.5.2.3.29.06,Pengadaan Langsung,01/03/2016,31/03/2016,01/04/2016,30/04/2016,
7832812,Belanja Cetak UPT Puskesmas Ujung Berung Indah,35335000,Pengadaan Langsung,APBD,Pemerintah Daerah Kota Bandung,DINAS KESEHATAN,2016,Bantuan Operasional Kesehatan (DAK),Barang/jasa,Jasa Lainnya,1 Tahun,Kota Bandung,Belanja Cetak UPT Puskesmas Ujung Berung Indah,APBD,35335000,1.02.1.02.01.26.16.43.5.2.2.06.01,Pengadaan Langsung,01/09/2016,14/09/2016,14/09/2016,13/10/2016,
7007711,Belanja bahan kimia,452000000,Lelang Sederhana,APBD,Pemerintah Daerah Kota Bandung,DINAS KESEHATAN,2016,Pelayanan penderita DBD yang ditangani,Barang/jasa,Barang,1 Paket,Kota Bandung,Belanja bahan kimia,APBD,452000000,1.02.1.02.01.01.34.7.5.2.2.02.05,Lelang Sederhana,14/03/2016,13/04/2016,14/04/2016,14/05/2016,
8428290,Belanja modal peralatan dan mesin -pengadaan alat kantor lainnya - mesin absensi kegiatan Pengadaan pakaian dinas beserta perlengkapannya,539000000,e-Purchasing,APBDP,Pemerintah Daerah Kota Bandung,DINAS KESEHATAN,2016,Pengadaan pakaian dinas beserta perlengkapannya,Modal,Barang,77 unit,Kota Bandung,Belanja modal peralatan dan mesin -pengadaan alat kantor lainnya - mesin absensi kegiatan Pengadaan pakaian dinas beserta perlengkapannya,APBDP,539000000,1.02.1.02.01.01.03.02.5.2.3.27.05,E-Purchasing,18/11/2016,26/11/2016,28/11/2016,08/12/2016,
7535514,Konsultan Pengawas Puskesmas Sukajadi,49500000,Pengadaan Langsung,APBD,Pemerintah Daerah Kota Bandung,DINAS KESEHATAN,2016,Pembangunan Puskesmas ,Modal,Jasa Konsultansi,1 Paket,Kota Bandung,Konsultan Pengawas Puskesmas Sukajadi,APBD,49500000,1.02.1.02.01.01.25.01.5.2.3.49.06,Pengadaan Langsung,10/05/2016,31/05/2016,01/06/2016,31/10/2016,Konsultan Perencana Puskesmas Sukajadi (7394205) 
7017329,Belanja kursus-kursus singkat/pelatihan : Seminar tatalaksana TB anak bagi dokter fungsional,80000000,Pengadaan Langsung,APBD,Pemerintah Daerah Kota Bandung,DINAS KESEHATAN,2016,Penemuan dan penanganan pasien baru TB BTA positif,Barang/jasa,Jasa Lainnya,1 Paket,Kota Bandung,Seminar tatalaksana TB anak bagi dokter fungsional,APBD,80000000,1.02.1.02.01.01.34.6.5.2.2.17.01,Pengadaan Langsung,16/03/2016,31/03/2016,01/04/2016,31/10/2016,
7826330,Belanja penggandaan pada kegiatan BOK UPT Puskesmas Puter,49100553,Pengadaan Langsung,APBD,Pemerintah Daerah Kota Bandung,DINAS KESEHATAN,2016,Bantuan Operasional Kesehatan (DAK) ,Barang/jasa,Jasa Lainnya,1 paket,Kota Bandung,Belanja penggandaan pada kegiatan BOK UPT Puskesmas Puter,APBD,49100553,1.02.1.02.01.09.16.43.5.2.2.06.02,Pengadaan Langsung,29/09/2016,14/10/2016,14/10/2016,15/12/2016,
7380638,Pembelian spare part Dental unit,100000000,Pengadaan Langsung,APBD,Pemerintah Daerah Kota Bandung,DINAS KESEHATAN,2016,Rehabilitasi Puskesmas,Barang/jasa,Barang,1 Paket,Kota Bandung,Pembelian spare part Dental unit Puskesmas,APBD,100000000,1.02.1.02.01.01.25.24.5.2.2.20.08,Pengadaan Langsung,02/05/2016,18/05/2016,19/05/2016,18/10/2016,
7380522,Pemeliharaan Instalasi Listrik,20000000,Pengadaan Langsung,APBD,Pemerintah Daerah Kota Bandung,DINAS KESEHATAN,2016,Rehabilitasi Puskesmas,Barang/jasa,Jasa Lainnya,2 Ls,Kota Bandung,Pemeliharaan Instalasi Listrik,APBD,20000000,1.02.1.02.01.01.25.24.5.2.2.20.08,Pengadaan Langsung,28/04/2016,18/05/2016,19/05/2016,18/10/2016,
7141694,Belanja modal peralatan dan mesin - Pengadaan personal komputer,1588000000,e-Purchasing,APBD,Pemerintah Daerah Kota Bandung,DINAS KESEHATAN,2016,Pengembangan data dan informasi pembangunan kesehatan ,Modal,Barang,1 paket,Kota Bandung,Belanja modal peralatan dan mesin - Pengadaan personal komputer,APBD,1588000000,1.02.1.02.01.36.03.5.2.3.29.02,E-Purchasing,01/05/2016,31/05/2016,01/06/2016,30/06/2016,
8416180,Belanja ATK Bantuan Operasional Kesehatan pada UPT Puskesmas Caringin,38701591,Pengadaan Langsung,APBDP,Pemerintah Daerah Kota Bandung,DINAS KESEHATAN,2016,Bantuan Operasional Kesehatan UPT Puskesmas Caringin,Barang/jasa,Barang,1 tahun,Kota Bandung,Belanja ATK Bantuan Operasional Kesehatan pada UPT Puskesmas Caringin,,,,Pengadaan Langsung,22/06/2016,01/07/2016,11/07/2016,28/12/2016,Belanja ATK Bantuan Operasional Kesehatan pada UPT Puskesmas Caringin (7800428) 
7380378,Pemeliharaan Alkes Gigi,130000000,Pengadaan Langsung,APBD,Pemerintah Daerah Kota Bandung,DINAS KESEHATAN,2016,Rehabilitasi Puskesmas,Barang/jasa,Jasa Lainnya,1 Paket,Kota Bandung,Pemeliharaan Alkes Gigi Puskesmas,APBD,130000000,1.02.1.02.01.01.25.24.5.2.2.20.08,Pengadaan Langsung,29/04/2016,16/05/2016,17/05/2016,16/09/2016,
7465799,Pemeliharaan   gedung dan bangunan Puskesmas Suryalaya,40000000,Pengadaan Langsung,APBD,Pemerintah Daerah Kota Bandung,DINAS KESEHATAN,2016,Pemeliharaan rutin/berkala gedung kantor ,Barang/jasa,Pekerjaan Konstruksi,1 Paket,Kota Bandung,Pemeliharaan gedung dan bangunan Puskesmas Suryalaya,APBD,40000000,1.02.1.02.01.01.02.22.5.2.2.20.05,Pengadaan Langsung,01/06/2016,30/06/2016,01/07/2016,31/07/2016,
7394911,Konsultan Pengawas UPT Puskesmas Arcamanik,49500000,Pengadaan Langsung,APBD,Pemerintah Daerah Kota Bandung,DINAS KESEHATAN,2016,Pembangunan Puskesmas,Modal,Jasa Konsultansi,1 Paket,Kota Bandung,Konsultan Pengawas UPT Puskesmas Arcamanik,APBD,49500000,1.02.1.02.01.01.25.01.5.2.3.49.06,Pengadaan Langsung,10/05/2016,30/05/2016,01/06/2016,31/10/2016,
7142030,Belanja modal peralatan dan mesin - Pengadaan peralatan studio visual (Display Utama),11500000,Pengadaan Langsung,APBD,Pemerintah Daerah Kota Bandung,DINAS KESEHATAN,2016,Pengembangan data dan informasi pembangunan kesehatan,Modal,Barang,12 unit,Kota Bandung,Belanja modal peralatan dan mesin - Pengadaan peralatan studio visual (Display Utama),APBD,11500000,1.02.1.02.01.36.03.5.2.3.31.01,Pengadaan Langsung,02/05/2016,31/05/2016,01/06/2016,30/06/2016,
8414955,Belanja makanan dan minuman kegiatan optimalisasi mutu pelayanan dasar,3400000,Pengadaan Langsung,APBDP,Pemerintah Daerah Kota Bandung,DINAS KESEHATAN,2016,Pembinaan pelayanan sarana kesehatan dasar swasta,Barang/jasa,Jasa Lainnya,40 OH,Kota Bandung,Belanja makanan dan minuman kegiatan optimalisasi mutu pelayanan dasar kegiatan Pembinaan pelayanan sarana kesehatan dasar swasta,APBDP,3400000,1.02.1.02.01.01.16.30.5.2.2.11.05,Pengadaan Langsung,18/11/2016,26/11/2016,28/11/2016,09/12/2016,
7394950,Pengadaan Pembangunan UPT Puskesmas Pelindung Hewan,1300000000,Pemilihan Langsung,APBD,Pemerintah Daerah Kota Bandung,DINAS KESEHATAN,2016,Pembangunan Puskesmas,Modal,Pekerjaan Konstruksi,1 Paket,Kota Bandung,Pengadaan Pembangunan UPT Puskesmas Pelindung Hewan,APBD,1300000000,1.02.1.02.01.01.25.01.5.2.3.49.06,Pemilihan Langsung,01/06/2016,30/06/2016,01/07/2016,31/10/2016,
7059639,Belanja modal alat-alat laboratorium kimia UPT Labkes dan Puskesmas,2500000000,Lelang Sederhana,APBD,Pemerintah Daerah Kota Bandung,DINAS KESEHATAN,2016,Pengadaan obat dan perbekalan kesehatan,Modal,Barang,1 tahun,Kota Bandung,Belanja modal alat-alat laboratorium komia UPT Labkes dan Puskesmas pada kegiatan pengadaan obat dan perbekalan kesehatan,APBD,2500000000,1.02.1.02.01.15.01.5.2.3.36.14,Lelang Sederhana,01/03/2016,31/03/2016,01/04/2016,29/07/2016,
7468868,Jasa Konsultansi Asset,50000000,Pengadaan Langsung,APBD,Pemerintah Daerah Kota Bandung,DINAS KESEHATAN,2016,Penyusunan dan Pemutakhiran Database Aset,Barang/jasa,Jasa Konsultansi,1 Paket,Kota Bandung,Penyusunan dan Pemutakhiran Database Aset,APBD,50000000,1.02.1.02.01.01.17.33.5.2.2.21.02,Pengadaan Langsung,01/06/2016,30/06/2016,01/07/2016,31/07/2016,
6662439,Belanja cetak pada kegiatan Pelayanan kesehatan,75000000,Pengadaan Langsung,APBD,Pemerintah Daerah Kota Bandung,DINAS KESEHATAN,2016,Pelayanan kesehatan,Barang/jasa,Barang,1 paket,Kota Bandung,Belanja cetak pada kegiatan Pelayanan kesehatan,APBD,75000000,1.02.1.02.01.01.30.6.5.2.2.06.01,Pengadaan Langsung,19/02/2016,29/02/2016,01/03/2016,31/03/2016,
7826074,Belanja penggandaan pada kegiatan BOK UPT Puskesmas Sukajadi,18629900,Pengadaan Langsung,APBD,Pemerintah Daerah Kota Bandung,DINAS KESEHATAN,2016,Bantuan Operasional Kesehatan (DAK),Barang/jasa,Jasa Lainnya,1 tahun,Kota Bandung,Belanja penggandaan pada kegiatan BOK UPT Puskesmas Sukajadi,APBD,18629900,1.02.1.02.01.04.16.43.5.2.2.06.02,Pengadaan Langsung,29/09/2016,14/10/2016,14/10/2016,15/12/2016,
7739495,Asistensi rencana kegiatan BOK,139430000,Pengadaan Langsung,APBD,Pemerintah Daerah Kota Bandung,DINAS KESEHATAN,2016,Bantuan operasional kesehatan,Barang/jasa,Jasa Lainnya,191 OK,Kota Bandung,Asistensi rencana kegiatan BOK,APBD,139430000,1.02.1.02.01.01.16.43.5.2.2.17.02,Pengadaan Langsung,01/06/2016,01/07/2016,01/08/2016,31/08/2016,
7111504,Belanja kursus-kursus singkat pelatihan: Manajemen pengelolaan imunisasi,178800000,Pengadaan Langsung,APBD,Pemerintah Daerah Kota Bandung,DINAS KESEHATAN,2016,Pelayanan imunisasi dasar,Barang/jasa,Jasa Lainnya,1 Paket,Kota Bandung,Belanja kursus-kursus singkat pelatihanManajemen pengelolaan imunisasi,APBD,178800000,1.02.1.02.01.01.34.16.5.2.2.17.01,Pengadaan Langsung,23/03/2016,29/03/2016,30/03/2016,31/05/2016,
7739447,Belanja sosialisasi BOK tingkat dinas dan puskesmas,229200000,Lelang Sederhana,APBD,Pemerintah Daerah Kota Bandung,DINAS KESEHATAN,2016,Bantuan Operasional Kesehatan,Barang/jasa,Jasa Lainnya,191 OK,Kota Bandung,Belanja sosialisasi BOK tingkat dinas dan puskesmas,APBD,229200000,1.02.1.02.01.01.16.43.5.2.2.17.02,Lelang Sederhana,01/06/2016,01/07/2016,01/08/2016,31/08/2016,
8188276,Belanja modal peralatan dan mesin - Pengadaan alat kantor lainnya,4200000,Pengadaan Langsung,APBDP,Pemerintah Daerah Kota Bandung,DINAS KESEHATAN,2016,Penyusunan standar pelayanan kesehatan ,Modal,Barang,2 buah,Kota Bandung,Belanja modal peralatan dan mesin - Pengadaan alat kantor lainnya (alat penghancur kertas),APBDP,4200000,1.02.1.02.01.01.23.01.5.2.3.27.05,Pengadaan Langsung,01/11/2016,16/11/2016,16/11/2016,15/12/2016,
7142011,Belanja modal peralatan dan mesin - Pengadaan peralatan studio visual (kamera),10000000,e-Purchasing,APBD,Pemerintah Daerah Kota Bandung,DINAS KESEHATAN,2016,Pengembangan data dan informasi pembangunan kesehatan,Modal,Barang,1 unit,Kota Bandung,Belanja modal peralatan dan mesin - Pengadaan peralatan studio visual (kamera),APBD,10000000,1.02.1.02.01.36.03.5.2.3.31.01,E-Purchasing,02/05/2016,31/05/2016,01/06/2016,30/06/2016,
7827883,Belanja Penggandaan UPT PKM Kujang Sari,35735600,Pengadaan Langsung,APBD,Pemerintah Daerah Kota Bandung,DINAS KESEHATAN,2016,Bantuan Operasional Kesehatan (DAK) UPT PKM Kujang Sari,Barang/jasa,Jasa Lainnya,1 Tahun,Kota Bandung,Belanja Penggandaan UPT PKM Kujang Sari,APBD,35735600,1.02.1.02.01.21.16.43.5.2.2.06.02,Pengadaan Langsung,11/07/2016,11/08/2016,12/08/2016,28/12/2016,
7825928,Belanja Bahan Medis Habis Pakai Kegiatan BOK UPT Puskesmas Sukarasa,67579211,e-Purchasing,APBD,Pemerintah Daerah Kota Bandung,DINAS KESEHATAN,2016,Bantuan Operasional Kesehatan (DAK),Barang/jasa,Barang,1 tahun,Kota Bandung,Belanja Bahan Medis Habis Pakai Kegiatan BOK UPT Puskesmas Sukarasa,APBD,67579211,1.02.1.02.01.05.16.43.5.2.2.02.09,E-Purchasing,29/09/2016,14/10/2016,14/10/2016,15/12/2016,
7143103,Belanja Alat Listrik dan Elektronik,76800000,Pengadaan Langsung,APBD,Pemerintah Daerah Kota Bandung,DINAS KESEHATAN,2016,Penyediaan Komponen Instalasi Listrik/Penerangan,Barang/jasa,Barang,1 Paket,Kota Bandung,Penyediaan Komponen Instalasi Listrik/Penerangan Dinas dan Puskesmas,APBD,76800000,1.02.1.02.01.01.01.12.5.2.2.01.03,Pengadaan Langsung,01/04/2016,20/04/2016,21/04/2016,20/05/2016,
