id,nama_paket,pagu,metode_pemilihan,sumber_dana,instansi,skpd,tahun_anggaran,nama_kegiatan,jenis_belanja,jenis_pengadaan,volume,lokasi,deskripsi,sumber_dana_detail,pagu_detail,mata_anggaran,pemilihan_penyedia,awal_pemilihan,akhir_pemilihan,awal_pekerjaan,akhir_pekerjaan,
8537110,Belanja jasa pemasangan iklan - Penyebaran informasi kesehatan,50000000,Pengadaan Langsung,APBD,Pemerintah Daerah Kota Bandung,DINAS KESEHATAN,2016,Promosi kesehatan dan kelurahan siaga aktif,Barang/jasa,Jasa Lainnya,1 paket,Kota Bandung,Belanja jasa pemasangan iklan - Penyebaran informasi kesehatan,APBD,50000000,1.02.1.02.01.01.19.07.5.2.2.03.14,Pengadaan Langsung,14/11/2016,28/11/2016,28/11/2016,09/12/2016,
7021358,Belanja modal peralatan dan mesin - pengadaan alat kedokteran umum: Food Contamination Kit,190000000,Pengadaan Langsung,APBD,Pemerintah Daerah Kota Bandung,DINAS KESEHATAN,2016,Pengawasan dan pengendalian keamanan dan kesehatan makanan restaurant,Modal,Barang,1 Paket,Kota Bandung,Food Contamination Kit,APBD,190000000,1.02.1.02.01.01.31.3.5.2.2.34.01,Pengadaan Langsung,16/03/2016,31/03/2016,01/04/2016,30/04/2016,
7465776,Pemeliharaan   gedung dan bangunan Puskesmas Talaga Bodas,40000000,Pengadaan Langsung,APBD,Pemerintah Daerah Kota Bandung,DINAS KESEHATAN,2016,Pemeliharaan rutin/berkala gedung kantor,Barang/jasa,Pekerjaan Konstruksi,1 Paket,Kota Bandung,Pemeliharaan gedung dan bangunan Puskesmas Talaga Bodas,APBD,40000000,1.02.1.02.01.01.02.22.5.2.2.20.05,Pengadaan Langsung,01/06/2016,30/06/2016,01/07/2016,31/07/2016,
8428209,Belanja modal peralatan dan mesin -pengadaan personal komputer -printer  kegiatan Penyediaan peralatan dan perlengkapan kantor,27500000,e-Purchasing,APBDP,Pemerintah Daerah Kota Bandung,DINAS KESEHATAN,2016,Penyediaan peralatan dan perlengkapan kantor,Modal,Barang,9 unit,Kota Bandung,Belanja modal peralatan dan mesin -pengadaan personal komputer -printer kegiatan Penyediaan peralatan dan perlengkapan kantor,APBDP,27500000,1.02.1.02.01.01.01.13.5.2.3.29.05,E-Purchasing,18/11/2016,26/11/2016,28/11/2016,08/12/2016,
5773695,Belanja Modal Gedung dan Bangunan - Konsultan Perencana Pembangunan Gedung UPT Puskesmas Sindang Jaya,100000000,Seleksi Sederhana,APBD,Pemerintah Daerah Kota Bandung,DINAS KESEHATAN,2016,Pembangunan Puskesmas,Modal,Jasa Konsultansi,1 paket,Kota Bandung,Konsultan Perencana Pembangunan Gedung UPT Puskesmas Sindang Jaya,APBD,100000000,1.02.1.02.01.25.01.5.2.3.59.06,Seleksi Sederhana,18/01/2016,29/02/2016,01/03/2016,29/04/2016,
8428281,Belanja modal peralatan dan mesin -pengadaan kendaraan bermotor khusus kegiatan Pengadaan kendaraan dinas / operasional,275000000,e-Purchasing,APBDP,Pemerintah Daerah Kota Bandung,DINAS KESEHATAN,2016,Pengadaan kendaraan dinas / operasional,Modal,Barang,1 unit,Kota Bandung,Belanja modal peralatan dan mesin -pengadaan kendaraan bermotor khusus kegiatan Pengadaan kendaraan dinas / operasional,APBDP,275000000,1.02.1.02.01.01.02.05.5.2.3.17.04,E-Purchasing,18/11/2016,26/11/2016,28/11/2016,31/12/2016,
7019222,Belanja jasa konsultansi perencanaan,150000000,Seleksi Sederhana,APBD,Pemerintah Daerah Kota Bandung,DINAS KESEHATAN,2016,Pengkajian pengembangan lingkungan sehat,Barang/jasa,Jasa Konsultansi,1 paket,Kota Bandung,Belanja jasa konsultansi perencanaan,APBD,150000000,1.02.1.02.01.01.21.1.5.2.2.21.02,Seleksi Sederhana,01/04/2016,31/05/2016,01/06/2016,30/09/2016,
7018037,Belanja jasa penyelenggaraan acara: Pelatihan wirausaha sanitasi,140000000,Pengadaan Langsung,APBD,Pemerintah Daerah Kota Bandung,DINAS KESEHATAN,2016,Pengkajian pengembangan lingkungan sehat,Barang/jasa,Jasa Lainnya,1 paket,Kota Bandung,Pelatihan wirausaha sanitasi,APBD,140000000,1.02.1.02.01.01.21.1.5.2.2.03.21,Pengadaan Langsung,16/03/2016,31/03/2016,01/04/2016,31/10/2016,
7008356,Belanja modal kendaraan bermotor: Kendaraan roda 2 trail khusus TRC,37975000,Pengadaan Langsung,APBD,Pemerintah Daerah Kota Bandung,DINAS KESEHATAN,2016,Penyelidikan epidemiologi dan penanggulangan KLB,Modal,Barang,1 Paket,Kota Bandung,Kendaraan roda 2 trail khusus TRC,APBD,37975000,1.02.1.02.01.01.37.1.5.2.3.17.05,Pengadaan Langsung,14/03/2016,31/03/2016,01/04/2016,31/05/2016,
7017273,Belanja kursus-kursus singkat/pelatihan : Pelatihan stratgei DOTS bagi dokter dan perawat puskesmas,60000000,Pengadaan Langsung,APBD,Pemerintah Daerah Kota Bandung,DINAS KESEHATAN,2016,Penemuan dan penanganan pasien baru TB BTA positif,Barang/jasa,Jasa Lainnya,1 Paket,Kota Bandung,Pelatihan stratgei DOTS bagi dokter dan perawat puskesmas,APBD,60000000,1.02.1.02.01.01.34.6.5.2.2.17.01,Pengadaan Langsung,16/03/2016,31/03/2016,01/04/2016,31/10/2016,
7827508,Belanja Makanan dan Minuman Kegiatan UPT PKM Pasundan,105200000,Pengadaan Langsung,APBD,Pemerintah Daerah Kota Bandung,DINAS KESEHATAN,2016,Bantuan Operasional Kesehatan (DAK) UPT PKM Pasundan,Barang/jasa,Jasa Lainnya,1 Paket,Kota Bandung,Belanja Makanan dan Minuman Kegiatan UPT PKM Pasundan,APBD,105200000,1.02.1.02.01.14.16.43.5.2.2.11.05,Pengadaan Langsung,11/07/2016,11/08/2016,12/08/2016,28/12/2016,
8162693,Belanja barang alkes kedokteran (paket 21),36000000,e-Purchasing,APBDP,Pemerintah Daerah Kota Bandung,DINAS KESEHATAN,2016,Pengadaan obat dan perbekalan kesehatan,Modal,Barang,1 tahun,Kota Bandung,Belanja barang alkes kedokteran,APBDP,36000000,1.02.1.02.01.01.15.01.5.2.3.19.01,E-Purchasing,01/11/2016,14/11/2016,15/11/2016,30/11/2016,
6666555,Belanja makanan dan minuman kegiatan PMT lokal bumil KEK pada kegiatan Pelayanan ibu hamil KEK,216000000,Lelang Sederhana,APBD,Pemerintah Daerah Kota Bandung,DINAS KESEHATAN,2016,Pelayanan ibu hamil KEK,Barang/jasa,Barang,13500 OH,Kota Bandung,Belanja makanan dan minuman kegiatan PMT lokal bumil KEK pada kegiatan Pelayanan ibu hamil KEK,APBD,216000000,1.02.1.02.01.01.34.19.5.2.2.11.05,Lelang Sederhana,11/01/2016,29/02/2016,01/03/2016,31/07/2016,
7017393,Belanja kursu-kursus singkat/pelatihan: workshop tatalaksana kolaborasi TB-HIV bagi petugas TB puskesmas,180000000,Pengadaan Langsung,APBD,Pemerintah Daerah Kota Bandung,DINAS KESEHATAN,2016,Penemuan dan penanganan pasien baru TB BTA positif,Barang/jasa,Jasa Lainnya,1 Paket,Kota Bandung,Workshop tatalaksana kolaborasi TB-HIV bagi petugas TB puskesmas,APBD,180000000,1.02.1.02.01.01.34.6.5.2.2.17.01,Pengadaan Langsung,16/03/2016,31/03/2016,01/04/2016,31/10/2016,
7381196,Konsultan Pengawas Puskesmas Karang Setra,30000000,Pengadaan Langsung,APBD,Pemerintah Daerah Kota Bandung,DINAS KESEHATAN,2016,Rehabilitasi Puskesmas,Modal,Jasa Konsultansi,1 Paket,Kota Bandung,Konsultan Pengawas Puskesmas Karang Setra,APBD,30000000,1.02.1.02.01.01.25.24.5.2.3.49.06,Pengadaan Langsung,02/05/2016,25/05/2016,26/05/2016,24/06/2016,
8166418,Belanja Bahan Medis Habis Pakai pada  UPT PKM Padasuka,50836337,Pengadaan Langsung,APBD,Pemerintah Daerah Kota Bandung,DINAS KESEHATAN,2016,Bantuan Operasional Puskesmas (DAK) UPT PKM Padasuka,Barang/jasa,Barang,1 Tahun,Kota Bandung,Belanja Bahan Medis Habis Pakai pada UPT PKM Padasuka,APBD,50836337,1.02.1.02.01.08.16.43.5.2.2.02.09,Pengadaan Langsung,10/10/2016,20/10/2016,21/10/2016,09/12/2016,
7465332,Pemeliharaan  gedung dan bangunan Puskesmas Taman Sari,40000000,Pengadaan Langsung,APBD,Pemerintah Daerah Kota Bandung,DINAS KESEHATAN,2016,Pemeliharaan rutin/berkala gedung Kantor,Barang/jasa,Pekerjaan Konstruksi,1 Paket,Kota Bandung,Pemeliharaan gedung dan bangunan Puskesmas Taman Sari,APBD,40000000,1.02.1.02.01.01.02.22.5.2.2.20.05,Pengadaan Langsung,23/05/2016,06/06/2016,07/06/2016,05/07/2016,
7017874,"Belanja spanduk, brosur, pamflet, umbul-umbul dan sarana informasi lainnya",43250000,Pengadaan Langsung,APBD,Pemerintah Daerah Kota Bandung,DINAS KESEHATAN,2016,Pengkajian pengembangan lingkungan sehat,Barang/jasa,Jasa Lainnya,1 paket,Kota Bandung,"Belanja spanduk, brosur, pamflet, umbul-umbul dan sarana informasi lainnya",APBD,43250000,1.02.1.02.01.01.21.1.5.2.2.01.10,Pengadaan Langsung,16/03/2016,31/03/2016,01/04/2016,31/05/2016,
7022196,Belanja alat tulis kantor,33154600,Pengadaan Langsung,APBD,Pemerintah Daerah Kota Bandung,DINAS KESEHATAN,2016,Pelayanan pencegahan dan penanggulangan penyakit menular,Barang/jasa,Barang,1 Paket,Kota Bandung,Belanja alat tulis kantor,APBD,33154600,1.02.1.02.01.01.22.5.5.2.2.01.01,Pengadaan Langsung,01/02/2016,15/02/2016,16/02/2016,30/04/2016,
7468703,Pemeliharaan  gedung dan bangunan Puskesmas Mengger,40000000,Pengadaan Langsung,APBD,Pemerintah Daerah Kota Bandung,DINAS KESEHATAN,2016,Pemeliharaan rutin/berkala gedung kantor,Barang/jasa,Pekerjaan Konstruksi,1 Paket,Kota Bandung,Pemeliharaan gedung dan bangunan Puskesmas Mengger,APBD,40000000,1.02.1.02.01.01.02.22.5.2.2.20.05,Pengadaan Langsung,01/06/2016,30/06/2016,01/07/2016,31/07/2016,
7010400,workshop/pelatihan singkat: Peningkatan kasitas SDM surveilance epidemiologi AFP & PD3I,28000000,Pengadaan Langsung,APBD,Pemerintah Daerah Kota Bandung,DINAS KESEHATAN,2016,Penemuan dan penanganan Acute Flacid Paralysis (AFP) Rate Per 100.000 penduduk < 15 tahun,Barang/jasa,Jasa Lainnya,1 Paket,Kota Bandung,workshop/pelatihan singkatPeningkatan kasitas SDM surveilance epidemiologi AFP & PD3I,APBD,28000000,1.02.1.02.01.01.34.4.5.2.2.17.01,Pengadaan Langsung,01/04/2016,18/04/2016,19/04/2016,31/05/2016,
8428065,Belanja pemeliharaan peralatan dan perlengkapan kantor/rumah tangga,151800000,Pengadaan Langsung,APBDP,Pemerintah Daerah Kota Bandung,DINAS KESEHATAN,2016,Penyediaan peralatan dan perlengkapan kantor,Barang/jasa,Jasa Lainnya,1 tahun,Kota Bandung,Belanja pemeliharaan peralatan dan perlengkapan kantor/rumah tangga,,,,Pengadaan Langsung,21/03/2016,31/03/2016,01/04/2016,01/12/2016,Belanja pemeliharaan peralatan dan perlengkapan kantor/rumah tangga (7371703) 
7381711,Konsultan Perencana Puskesmas Astana Anyar,16000000,Pengadaan Langsung,APBD,Pemerintah Daerah Kota Bandung,DINAS KESEHATAN,2016,Rehabilitasi Puskesmas,Modal,Jasa Konsultansi,1 Paket,Kota Bandung,Konsultan Perencana Puskesmas Astana Anyar,APBD,16000000,1.02.1.02.01.01.25.24.5.2.3.49.06,Pengadaan Langsung,03/05/2016,26/05/2016,27/05/2016,24/06/2016,
8162532,Belanja barang alkes kedokteran (paket 16),36000000,e-Purchasing,APBDP,Pemerintah Daerah Kota Bandung,DINAS KESEHATAN,2016,Pengadaan obat dan perbekalan kesehatan,Modal,Barang,1 tahun,Kota Bandung,Belanja barang alkes kedokteran,APBDP,36000000,1.02.1.02.01.01.15.01.5.2.3.19.01,E-Purchasing,01/11/2016,14/11/2016,15/11/2016,30/11/2016,
8653413,UPS (Puskesmas 24 jam),3000000,Pengadaan Langsung,APBDP,Pemerintah Daerah Kota Bandung,DINAS KESEHATAN,2016,Penyediaan peralatan dan perlengkapan kantor,Modal,Barang,2 unit,Jl. Supratman No 73 Bandung,Jl. Supratman No 73 Bandung,APBDP,3000000,1.02.1.02.01.01.01.13.5.2.3.29.05,Pengadaan Langsung,15/11/2016,25/11/2016,28/11/2016,23/12/2016,
8428314,Belanja Jasa konsultansi perencanaan  DED Puskesmas Panyileukan,50000000,Pengadaan Langsung,APBDP,Pemerintah Daerah Kota Bandung,DINAS KESEHATAN,2016,Pembangunan Puskesmas,Barang/jasa,Jasa Konsultansi,1 paket,Kota Bandung,Belanja Jasa konsultansi perencanaan DED Puskesmas Panyileukan,APBDP,50000000,1.02.1.02.01.01.25.01.5.2.2.21.02,Pengadaan Langsung,18/11/2016,26/11/2016,28/11/2016,08/12/2016,
8428155,Belanja modal peralatan dan mesin -pengadaan alat penyimpanan perlengkapan kantor -rak gudang arsip kegiatan Penyediaan peralatan dan perlengkapan kantor,50000000,Pengadaan Langsung,APBDP,Pemerintah Daerah Kota Bandung,DINAS KESEHATAN,2016,Penyediaan peralatan dan perlengkapan kantor,Modal,Barang,1 paket,Kota Bandung,Belanja modal peralatan dan mesin -pengadaan alat penyimpanan perlengkapan kantor -rak gudang arsip kegiatan Penyediaan peralatan dan perlengkapan kantor,APBDP,50000000,1.02.1.02.01.01.01.13.5.2.3.27.04,Pengadaan Langsung,18/11/2016,26/11/2016,28/11/2016,08/12/2016,
7394700,Pembangunan Gedung UPT Puskesmas Ujung Berung Indah,2000000000,Pemilihan Langsung,APBD,Pemerintah Daerah Kota Bandung,DINAS KESEHATAN,2016,Pembangunan Puskesmas,Modal,Pekerjaan Konstruksi,1 Paket,Kota Bandung,Pembangunan Gedung UPT Puskesmas Ujung Berung Indah,APBD,2000000000,1.02.1.02.01.01.25.01.5.2.3.49.06,Pemilihan Langsung,01/06/2016,30/06/2016,01/07/2016,31/10/2016,
8672486,Komputer PC (Kesling),15000000,Pengadaan Langsung,APBD,Pemerintah Daerah Kota Bandung,DINAS KESEHATAN,2016,Penyediaan Peralatan dan Perlengkapan kantor,Modal,Barang,1 Unit,Jl. Supratman No 73 Bandung,Komputer PC (Kesling),APBD,15000000,1.02.1.02.01.01.01.13.5.2.3.29.02,Pengadaan Langsung,15/11/2016,25/11/2016,28/11/2016,23/12/2016,
7721813,Pemeliharaan gedung dan bangunan puskemas cipaku,40000000,Pengadaan Langsung,APBD,Pemerintah Daerah Kota Bandung,DINAS KESEHATAN,2016,Pemeliharaan Rutin/berkala gedung kantor,Barang/jasa,Pekerjaan Konstruksi,1 Paket,jl. cipaku,Pemeliharaan gedung bangunan puskemas cipaku,APBD,40000000,1.02.1.02.01.01.02.22.5.2.2.20.05,Pengadaan Langsung,01/08/2016,16/08/2016,18/08/2016,19/09/2016,
8653287,Printer (Pelayanan keuangan UPT BLUD),6000000,Pengadaan Langsung,APBDP,Pemerintah Daerah Kota Bandung,DINAS KESEHATAN,2016,Penyediaan peralatan dan perlengkapan kantor,Modal,Barang,2 unit,Jl. Supratman No 73 Bandung,Printer (Pelayanan keuangan UPT BLUD),APBDP,6000000,1.02.1.02.01.01.01.13.5.2.3.29.05,Pengadaan Langsung,15/11/2016,25/11/2016,28/11/2016,23/12/2016,
8416215,Belanja cetak Bantuan Operasional Kesehatan pada UPT Puskesmas Kopo,14050500,Pengadaan Langsung,APBDP,Pemerintah Daerah Kota Bandung,DINAS KESEHATAN,2016,Bantuan Operasional Kesehatan UPT Puskesmas Kopo,Barang/jasa,Barang,1 tahun,Kota Bandung,Belanja cetak Bantuan Operasional Kesehatan pada UPT Puskesmas Kopo,,,,Pengadaan Langsung,22/06/2016,01/07/2016,11/07/2016,28/12/2016,Belanja cetak Bantuan Operasional Kesehatan pada UPT Puskesmas Kopo (7755630) 
7826156,Belanja cetak pada kegiatan BOK UPT Puskesmas Pasirkaliki,32830400,Pengadaan Langsung,APBD,Pemerintah Daerah Kota Bandung,DINAS KESEHATAN,2016,Bantuan Operasional Kesehatan (DAK) ,Barang/jasa,Jasa Lainnya,1 tahun ,Kota Bandung,Belanja cetak pada kegiatan BOK UPT Puskesmas Pasirkaliki,APBD,32830400,1.02.1.02.01.03.16.43.5.2.2.06.01,Pengadaan Langsung,29/09/2016,14/10/2016,14/10/2016,15/12/2016,
6657344,Belanja cetak publikasi/dokumentasi kegiatan PON pada kegiatan pelayanan kesehatan olah raga,20000000,Pengadaan Langsung,APBD,Pemerintah Daerah Kota Bandung,DINAS KESEHATAN,2016,pelayanan kesehatan olah raga,Barang/jasa,Barang,1 paket,Kota Bandung,Belanja cetak publikasi/dokumentasi kegiatan PON pada kegiatan pelayanan kesehatan olah raga,APBD,20000000,1.02.1.02.01.01.16.34.5.2.2.06.03,Pengadaan Langsung,21/03/2016,31/03/2016,01/04/2016,30/04/2016,
7078885,Belanja cetak kegiatan Pelayanan kesehatan anak balita,30000000,Pengadaan Langsung,APBD,Pemerintah Daerah Kota Bandung,DINAS KESEHATAN,2016,Pelayanan kesehatan anak balita,Barang/jasa,Jasa Lainnya,1 paket,Kota Bandung,Belanja cetak kegiatan Pelayanan kesehatan anak balita,APBD,30000000,1.02.1.02.01.01.34.17.5.2.2.06.01,Pengadaan Langsung,02/03/2016,12/03/2016,14/03/2016,31/03/2016,
6661752,Belanja makanan dan minuman pada kegiatan Kemitraan pengobatan lanjutan bagi pasien rujukan,56250000,Pengadaan Langsung,APBD,Pemerintah Daerah Kota Bandung,DINAS KESEHATAN,2016,Kemitraan pengobatan lanjutan bagi pasien rujukan,Barang/jasa,Jasa Lainnya,1050 OH,Kota Bandung,Belanja makanan dan minuman pada kegiatan Kemitraan pengobatan lanjutan bagi pasien rujukan,APBD,56250000,1.02.1.02.01.01.28.6.5.2.2.11.05,Pengadaan Langsung,01/03/2016,14/03/2016,15/03/2016,31/10/2016,
7111809,Belanja pemeliharaan peralatan dan perlengkapan kantor/rumah tangga: Pemeliharaan lemari es,50000000,Pengadaan Langsung,APBD,Pemerintah Daerah Kota Bandung,DINAS KESEHATAN,2016,Pelayanan imunisasi dasar,Barang/jasa,Jasa Lainnya,1 Paket,Kota Bandung,Pemeliharaan lemari es,APBD,50000000,1.02.1.02.01.01.34.16.5.2.2.20.08,Pengadaan Langsung,24/03/2016,31/03/2016,01/04/2016,30/11/2016,
7388454,Konsultan Perencana Puskesmas Mandala Mekar,30000000,Pengadaan Langsung,APBD,Pemerintah Daerah Kota Bandung,DINAS KESEHATAN,2016,Rehabilitasi Puskesmas,Modal,Jasa Konsultansi,1 Paket,Kota Bandung,KOnsultan Perencana Puskesmas Mandala Mekar,APBD,30000000,1.02.1.02.01.01.25.24.5.2.3.49.06,Pengadaan Langsung,04/05/2016,25/05/2016,26/05/2016,24/06/2016,
6663642,Belanja makanan dan minuman kegiatan Pelayanan balita gizi buruk mendapat perawatan,41140000,Pengadaan Langsung,APBD,Pemerintah Daerah Kota Bandung,DINAS KESEHATAN,2016,Pelayanan balita gizi buruk mendapat perawatan,Barang/jasa,Jasa Lainnya,608 OH,Kota Bandung,Belanja makanan dan minuman kegiatan Pelayanan balita gizi buruk mendapat perawatan,APBD,41140000,1.02.1.02.01.01.34.1.5.2.2.11.05,Pengadaan Langsung,07/03/2016,23/03/2016,24/03/2016,30/11/2016,
7831941,Belanja Cetak UPT Puskesmas Cibiru,47022000,Pengadaan Langsung,APBD,Pemerintah Daerah Kota Bandung,DINAS KESEHATAN,2016,Bantuan Operasional Kesehatan (BOK),Barang/jasa,Barang,1 Paket,Kota Bandung,Belanja Cetak UPT Puskesmas Cibiru,APBD,47022000,1.02.1.02.01.27.16.43.5.2.2.06.01,Pengadaan Langsung,01/09/2016,14/09/2016,14/09/2016,13/10/2016,
7697936,Belanja jasa penyelenggaraan acara Koordinasi sistem rujukan Kota Bandung,52850000,Pengadaan Langsung,APBD,Pemerintah Daerah Kota Bandung,DINAS KESEHATAN,2016,Kemitraan pengobatan lanjutan bagi pasien rujukan,Barang/jasa,Jasa Lainnya,1 paket,Kota Bandung,Belanja jasa penyelenggaraan acara Koordinasi sistem rujukan Kota Bandung,APBD,52850000,1.02.1.02.01.01.28.06.5.2.2.03.21,Pengadaan Langsung,10/08/2016,19/08/2016,22/08/2016,28/12/2016,
7141497,Belanja modal peralatan dan mesin - Alat access control,125000000,Pengadaan Langsung,APBD,Pemerintah Daerah Kota Bandung,DINAS KESEHATAN,2016,Pengembangan data dan informasi pembangunan kesehatan,Modal,Barang,26 unit,Kota Bandung,Belanja modal peralatan dan mesin - Alat access control,APBD,125000000,1.02.1.02.01.36.03.5.2.3.27.05,Pengadaan Langsung,01/03/2016,31/03/2016,01/04/2016,30/04/2016,
7064891,Belanja jasa konsultansi - Konsultansi ISO 9001:2008 dinas kesehatan dan 3 UPT Puskesmas,30000000,Pengadaan Langsung,APBD,Pemerintah Daerah Kota Bandung,DINAS KESEHATAN,2016,Penyusunan standar pelayanan kesehatan,Barang/jasa,Jasa Konsultansi,1 paket,Kota bandung,Belanja jasa konsultansi - Konsultansi ISO 9001:2008 dinas kesehatan dan 3 UPT Puskesmas,APBD,30000000,1.02.1.02.01.23.01.5.2.2.21.01,Pengadaan Langsung,01/03/2016,31/03/2016,01/04/2016,29/04/2016,
7139423,Belanja jasa konsultansi software perizinan (pengembangan),49000000,Pengadaan Langsung,APBD,Pemerintah Daerah Kota Bandung,DINAS KESEHATAN,2016,Penyusunan standar pelayanan kesehatan,Barang/jasa,Jasa Konsultansi,1 paket,Kota Bandung,Pengembangan software perizinan pada kegiatan penyusunan standar pelayanan kesehatan,APBD,49000000,1.02.1.02.01.23.01.5.2.2.21.01,Pengadaan Langsung,01/03/2016,31/03/2016,01/04/2016,30/04/2016,
8416045,Belanja makanan dan minuman penilaian RSSIB Kota Bandung pada kegiatan Kemitraan pengobatan lanjutan bagi pasien rujukan,2000000,Pengadaan Langsung,APBDP,Pemerintah Daerah Kota Bandung,DINAS KESEHATAN,2016,Kemitraan pengobatan lanjutan bagi pasien rujukan,Barang/jasa,Jasa Lainnya,40 OH,Kota Bandung,Belanja makanan dan minuman penilaian RSSIB Kota Bandung pada kegiatan Kemitraan pengobatan lanjutan bagi pasien rujukan,APBDP,2000000,1.02.1.02.01.01.28.06.5.2.2.11.05,Pengadaan Langsung,18/11/2016,26/11/2016,28/11/2016,08/12/2016,
8058560,Belanja Modal Peralatan dan Mesin-Pengadaan Meubelair-MOUBILER LAINNYA-Meja Kerja,182975000,Pengadaan Langsung,APBD,Pemerintah Daerah Kota Bandung,DINAS KESEHATAN,2016,Pengadaan Mebeleur,Modal,Barang,1 Paket,Jl. Supratman No. 73 Bandung,Belanja Modal Peralatan dan Mesin-Pengadaan Meubelair-MOUBILER LAINNYA-Meja Kerja,APBD,182975000,1.02.1.02.01.01.02.10.5.2.3.28.01,Pengadaan Langsung,02/10/2016,18/10/2016,19/10/2016,18/11/2016,
7021724,Belanja jasa penyelenggaraan acara: hari kanker sedunia,50000000,Pengadaan Langsung,APBD,Pemerintah Daerah Kota Bandung,DINAS KESEHATAN,2016,Pelayanan pencegahan dan penanggulangan penyakit tidak menular,Barang/jasa,Jasa Lainnya,1 Paket,Kota Bandung,Belanja jasa penyelenggaraan acarahari kanker sedunia,APBD,50000000,1.02.1.02.01.01.16.31.5.2.2.03.21,Pengadaan Langsung,01/02/2016,09/02/2016,10/02/2016,31/03/2016,
7465751,Pemeliharaan   gedung dan bangunan Puskesmas Ahmad Yani,40000000,Pengadaan Langsung,APBD,Pemerintah Daerah Kota Bandung,DINAS KESEHATAN,2016,Pemeliharaan rutin/berkala gedung kantor,Barang/jasa,Pekerjaan Konstruksi,1 Paket,Kota Bandung,Pemeliharaan gedung dan bangunan Puskesmas Ahmad Yani,APBD,40000000,1.02.1.02.01.01.02.22.5.2.2.20.05,Pengadaan Langsung,01/06/2016,30/06/2016,01/07/2016,31/07/2016,
6656767,Belanja Cetak kegiatan Pembinaan pelayanan sarana kesehatan dasar swasta,441675000,Pengadaan Langsung,APBD,Pemerintah Daerah Kota Bandung,DINAS KESEHATAN,2016,Pembinaan pelayanan sarana kesehatan dasar swasta,Barang/jasa,Barang,29445 lembar,Kota Bandung,Belanja cetak kegiatan Pembinaan pelayanan sarana kesehatan dasar swasta,APBD,441675000,1.02.1.02.01.01.16.30.5.2.2.06.01,Pengadaan Langsung,22/02/2016,04/03/2016,07/03/2016,31/03/2016,
8162642,Belanja barang alkes kedokteran (paket 19),57800000,e-Purchasing,APBDP,Pemerintah Daerah Kota Bandung,DINAS KESEHATAN,2016,Pengadaan obat dan perbekalan kesehatan,Modal,Barang,1 tahun,Kota Bandung,Belanja barang alkes kedokteran,APBDP,57800000,1.02.1.02.01.01.15.01.5.2.3.19.01,E-Purchasing,01/11/2016,14/11/2016,15/11/2016,30/11/2016,
7936583,Belanja bahan medis habis pakai Bantuan Operasional Kesehatan pada UPT Puskesmas Kopo,34198500,e-Purchasing,APBD,Pemerintah Daerah Kota Bandung,DINAS KESEHATAN,2016,Bantuan Operasional Kesehatan UPT Puskesmas Kopo,Barang/jasa,Barang,1 tahun,Kota Bandung,Belanja bahan medis habis pakai Bantuan Operasional Kesehatan pada UPT Puskesmas Kopo,APBD,34198500,1.02.1.02.01.19.16.43.5.2.2.02.09,E-Purchasing,22/06/2016,01/07/2016,11/07/2016,28/12/2016,Belanja bahan medis habis pakai Bantuan Operasional Kesehatan pada UPT Puskesmas Kopo (7755623) 
7017946,Belanja jasa penyelenggaraan acara: Gebyar Sanitasi,190000000,Pengadaan Langsung,APBD,Pemerintah Daerah Kota Bandung,DINAS KESEHATAN,2016,Pengkajian pengembangan lingkungan sehat,Barang/jasa,Jasa Lainnya,1 paket,Kota Bandung,Gebyar Sanitasi,APBD,190000000,1.02.1.02.01.01.21.1.5.2.2.03.21,Pengadaan Langsung,16/03/2016,31/03/2016,01/04/2016,31/10/2016,
7230857,Belanja Cetak Sarana Pelayanan Kesehatan Lansia,75000000,Pengadaan Langsung,APBD,Pemerintah Daerah Kota Bandung,DINAS KESEHATAN,2016,Pelayanan Kesehatan,Barang/jasa,Jasa Lainnya,1 paket,Kota Bandung,Belanja Cetak Sarana Pelayanan Kesehatan Lansia,APBD,75000000,1.02.1.02.01.01.34.6.5.2.2.06.01,Pengadaan Langsung,01/03/2016,12/03/2016,14/03/2016,31/03/2016,
6657430,Belanja kursus-kursus singkat/pelatihan workshop pelatihan kesehatan olah raga bagi puskesmas pada kegiatan pelayanan kesehatan olah raga,31350000,Pengadaan Langsung,APBD,Pemerintah Daerah Kota Bandung,DINAS KESEHATAN,2016,Pelayanan kesehatan olah raga,Barang/jasa,Jasa Lainnya,1 paket,Kota Bandung,Belanja kursus-kursus singkat/pelatihan workshop pelatihan kesehatan olah raga bagi puskesmas pada kegiatan pelayanan kesehatan olah raga,APBD,31350000,1.02.1.02.01.01.16.34.5.2.2.17.01,Pengadaan Langsung,22/02/2016,31/03/2016,01/04/2016,30/04/2016,
7019028,Belanja makanan dan minuman kegiatan: Pertemuan sosialisasi kebijakan pengendalian FR dan Pem.Kes CJH bagi dokter,30600000,Pengadaan Langsung,APBD,Pemerintah Daerah Kota Bandung,DINAS KESEHATAN,2016,Penyelidikan epidemiologi dan penanggulangan KLB,Barang/jasa,Jasa Lainnya,1 paket,Kota Bandung,Pertemuan sosialisasi kebijakan pengendalian FR dan Pem.Kes CJH bagi dokter,APBD,30600000,1.02.1.02.01.01.37.1.5.2.2.11.05,Pengadaan Langsung,01/02/2016,09/02/2016,10/02/2016,29/02/2016,
7022581,Belanja kursus-kursus singkat/pelatihan: Pelatihan tatalaksana IMS bagi petugas puskesmas,90000000,Pengadaan Langsung,APBD,Pemerintah Daerah Kota Bandung,DINAS KESEHATAN,2016,Pelayanan pencegahan dan penanggulangan penyakit menular,Barang/jasa,Jasa Lainnya,1 Paket,Kota Bandung,Pelatihan tatalaksana IMS bagi petugas puskesmas,APBD,90000000,1.02.1.02.01.01.22.5.5.2.2.17.01,Pengadaan Langsung,16/03/2016,31/03/2016,01/04/2016,31/10/2016,
8370418,Belanja makanan dan minuman kegiatan Sosialisasi e-RK (elektronik Remun dan Kinerja) dilingkungan Dnas Kesehatan Kota Bandung,7000000,Pengadaan Langsung,APBDP,Pemerintah Daerah Kota Bandung,DINAS KESEHATAN,2016,Program peningkatan kapasitas sumber daya aparatur,Barang/jasa,Jasa Lainnya,100 or,Kota Bandung,Belanja makanan dan minuman kegiatan Sosialisasi e-RK (elektronik Remun dan Kinerja) dilingkungan Dnas Kesehatan Kota Bandung,APBDP,7000000,1.02.1.02.01.01.05.01.5.2.2.11.05,Pengadaan Langsung,18/11/2016,26/11/2016,28/11/2016,17/12/2016,
7827288,Belanja Alat Tulis Kantor UPT PKM Pasundan,31568890,Pengadaan Langsung,APBD,Pemerintah Daerah Kota Bandung,DINAS KESEHATAN,2016,Bantuan Operasional Kesehatan (DAK) UPT PKM Pasundan,Barang/jasa,Barang,1 Paket,Kota Bandung,Belanja Alat Tulis Kantor UPT PKM Pasundan,APBD,31568890,1.02.1.02.01.14.16.43.5.2.2.01.01,Pengadaan Langsung,11/07/2016,11/08/2016,12/08/2016,12/09/2016,
7465454,Pemeliharaan gedung dan bangunan UPT Puskesmas Neglasari,40000000,Pengadaan Langsung,APBD,Pemerintah Daerah Kota Bandung,DINAS KESEHATAN,2016,Pemeliharaan rutin/berkala gedung Kantor,Barang/jasa,Pekerjaan Konstruksi,1 Paket,Kota Bandung,Pemeliharaan gedung dan bangunan UPT Puskesmas Neglasari,APBD,40000000,1.02.1.02.01.01.02.22.5.2.2.20.05,Pengadaan Langsung,23/05/2016,13/06/2016,14/06/2016,13/07/2016,
8672473,Komputer PC (Yandas),30000000,Pengadaan Langsung,APBD,Pemerintah Daerah Kota Bandung,DINAS KESEHATAN,2016,Penyediaan Peralatan dan Perlengkapan Kantor,Modal,Barang,2 unit,Jl. Supratman No 73 Bandung,Komputer PC (Yandas),APBD,30000000,1.02.1.02.01.01.01.13.5.2.3.29.02,Pengadaan Langsung,15/11/2016,25/11/2016,28/11/2016,23/12/2016,
